tentinh,tenxa,loai,matinh,maxa,danso,dientich_km2,trungtam_hc,truoc_sapnhap,kinhdo,vido
tỉnh Đồng Nai,An Lộc,phường,28,2310,35531,88.7,"Ấp Vườn Rau, phường Bình Long.","Phường Phú Thịnh, Xã Thanh Phú, Xã Thanh Lương",106.582,11.7021
tỉnh Đồng Nai,An Phước,xã,28,3147,23788,64.9,"Ấp 7, xã An Phước.","Xã Tam An, Xã An Phước",106.927,10.8061
tỉnh Đồng Nai,An Viễn,xã,28,3137,2415,47.7,"Đường ĐT 777, ấp 3, xã An Viễn.","Xã Đồi 61, Xã An Viễn",107.015,10.901
tỉnh Đồng Nai,Bảo Vinh,phường,28,3159,36989,50.9,"Đường Duy Tân, khu phố Ruộng Hời, phường Bảo Vinh.","Phường Bảo Vinh, Xã Bảo Quang",107.278,10.9683
tỉnh Đồng Nai,Bàu Hàm,xã,28,3134,55559,97.5,"Đường Trảng Bom - Cây Gáo, ấp Tân Lập 1, xã Bàu Hàm.","Xã Thanh Bình (huyện Trảng Bom), Xã Cây Gáo, Xã Sông Thao, Xã Bàu Hàm",107.085,11.0255
tỉnh Đồng Nai,Biên Hòa,phường,28,3156,74919,21.5,"Số 277 Nguyễn Tri Phương, khu phố 2, phường Biên Hòa.","Phường Tân Hạnh, Phường Hóa An, Phường Bửu Hòa, Phường Tân Vạn",106.802,10.9336
tỉnh Đồng Nai,Bình An,xã,28,3148,59475,73.43,"Đường Nguyễn Thị Giờ, khu 13, xã Bình An.","Xã Long Đức, Xã Bình An",107.014,10.8505
tỉnh Đồng Nai,Bình Lộc,phường,28,3158,36195,77.2,"Đường N5, phường Bình Lộc.","Phường Suối Tre, Xã Xuân Thiện, Xã Bình Lộc",107.223,10.9901
tỉnh Đồng Nai,Bình Long,phường,28,2309,41048,49.1,"Đường Lê Quý Đôn, phường Bình Long.","Phường An Lộc, Phường Hưng Chiến, Phường Phú Đức, Xã Thanh Bình (huyện Hớn Quản)",106.598,11.6321
tỉnh Đồng Nai,Bình Minh,xã,28,3136,83354,36.7,"Đường 65, ấp Tân Bắc, xã Bình Minh.","Xã Bình Minh (huyện Trảng Bom), Xã Bắc Sơn",106.97,10.9689
tỉnh Đồng Nai,Bình Phước,phường,28,2291,11144,86.4,"Đường Cách Mạng Tháng Tám, phường Bình Phước.","Phường Tân Phú, Phường Tân Đồng, Phường Tân Thiện, Phường Tân Bình, Phường Tân Xuân, Xã Tiến Hưng",106.899,11.5209
tỉnh Đồng Nai,Bình Tân,xã,28,2296,28642,190.9,"Thôn 1, xã Bình Tân.","Xã Long Hưng (huyện Phú Riềng), Xã Long Bình, Xã Bình Tân",106.806,11.8155
tỉnh Đồng Nai,Bom Bo,xã,28,2322,27064,245.9,"Thôn 3, xã Bom Bo.","Xã Bình Minh (huyện Bù Đăng), Xã Bom Bo",107.15,11.8698
tỉnh Đồng Nai,Bù Đăng,xã,28,2319,32145,156.1,"Quốc lộ 14, khu phố Hòa Đồng, xã Bù Đăng.","Thị trấn Đức Phong, Xã Đoàn Kết, Xã Minh Hưng",107.249,11.8184
tỉnh Đồng Nai,Bù Gia Mập,xã,28,2325,8274,342.5,"Thôn Bù Lư, xã Bù Gia Mập.",Không sáp nhập,107.168,12.1358
tỉnh Đồng Nai,Cẩm Mỹ,xã,28,3120,45728,113.1,"Khu phố Suối Râm, thị trấn Long Giao.","Thị trấn Long Giao, Xã Nhân Nghĩa, Xã Xuân Mỹ, Xã Bảo Bình",107.258,10.8061
tỉnh Đồng Nai,Chơn Thành,phường,28,2329,415,124.4,"Đường Hồ Văn Huê, khu phố Trung Lợi, phường Chơn Thành.","Phường Hưng Long, Phường Thành Tâm, Phường Minh Thành",106.646,11.4153
tỉnh Đồng Nai,Đa Kia,xã,28,2295,31752,196.3,đang cập nhật,"Xã Phước Minh, Xã Bình Thắng, Xã Đa Kia",106.863,11.9028
tỉnh Đồng Nai,Đại Phước,xã,28,3168,55364,98,"Đường Lý Thái Tổ, ấp Phước Lý, xã Đại Phước.","Xã Phú Hữu, Xã Phú Đông, Xã Phước Khánh, Xã Đại Phước",106.779,10.712
tỉnh Đồng Nai,Đak Lua,xã,28,3170,đang cập nhật,415.604,"Tổ 5, ấp 5, xã Đak Lua.",Không sáp nhập,107.32,11.4637
tỉnh Đồng Nai,Đak Nhau,xã,28,2320,đang cập nhật,182.571,đang cập nhật,"Xã Đường 10, Xã Đak Nhau",107.222,11.9733
tỉnh Đồng Nai,Đăk Ơ,xã,28,2316,đang cập nhật,246.711,"Thôn Đăk Lim, xã Đăk Ơ.",Không sáp nhập,107.056,12.067
tỉnh Đồng Nai,Dầu Giây,xã,28,3139,71921,98.9,"Ấp Lập Thành, xã Dầu Giây.","Thị trấn Dầu Giây, Xã Hưng Lộc, Xã Bàu Hàm 2, Xã Lộ 25",107.129,10.9214
tỉnh Đồng Nai,Định Quán,xã,28,3172,85523,295.8,"Đường Nguyễn Ái Quốc, tổ 3, khu phố Hiệp Tâm 1, thị trấn Định Quán.","Thị trấn Định Quán, Xã Phú Ngọc, Xã Gia Canh, Xã Ngọc Định",107.356,11.1398
tỉnh Đồng Nai,Đồng Phú,xã,28,2327,45557,138.7,"Đường Trần Phú, khu phố Tân An, xã Đồng Phú.","Thị trấn Tân Phú, Xã Tân Tiến (huyện Đồng Phú), Xã Tân Lập",106.847,11.4115
tỉnh Đồng Nai,Đồng Tâm,xã,28,2318,35573,248.8,"Quốc lộ 14, ấp 3, xã Đồng Tâm.","Xã Đồng Tiến, Xã Tân Phước, Xã Đồng Tâm",107.021,11.5709
tỉnh Đồng Nai,Đồng Xoài,phường,28,2292,35887,81.3,"Quốc lộ 14, phường Đồng Xoài.","Phường Tiến Thành, Xã Tân Thành (thành phố Đồng Xoài)",106.817,11.53
tỉnh Đồng Nai,Gia Kiệm,xã,28,3138,79274,82.7,"Ấp Nam Sơn, xã Gia Kiệm.","Xã Quang Trung, Xã Gia Tân 3, Xã Gia Kiệm",107.159,11.0194
tỉnh Đồng Nai,Hàng Gòn,phường,28,3160,24931,45.6,"Quốc lộ 56, phường Hàng Gòn.","Phường Xuân Tân, Xã Hàng Gòn",107.217,10.8786
tỉnh Đồng Nai,Hố Nai,phường,28,3124,78902,22.9,"Số 386 quốc lộ 1A, khu phố 1, phường Hố Nai.","Phường Tân Hòa, Xã Hố Nai 3",106.927,10.9755
tỉnh Đồng Nai,Hưng Phước,xã,28,2308,12427,187.2,"Ấp 4, xã Hưng Phước.","Xã Phước Thiện, Xã Hưng Phước",106.877,12.0352
tỉnh Đồng Nai,Hưng Thịnh,xã,28,3135,57825,57.6,"Quốc lộ 1, khu 6, ấp Bàu Cá, xã Hưng Thịnh.","Xã Đông Hòa, Xã Tây Hòa, Xã Trung Hòa, Xã Hưng Thịnh",107.065,10.9246
tỉnh Đồng Nai,La Ngà,xã,28,3131,33311,133.5,"Tổ nhân dân số 7, ấp 3, xã La Ngà.","Xã Túc Trưng, Xã La Ngà",107.216,11.1497
tỉnh Đồng Nai,Lộc Hưng,xã,28,2306,266,99,"Ấp 2, xã Lộc Hưng.","Xã Lộc Khánh, Xã Lộc Điền, Xã Lộc Hưng",106.664,11.7867
tỉnh Đồng Nai,Lộc Ninh,xã,28,2300,32213,67.4,"Số 1 đường 3/2, khu phố Ninh Thịnh, xã Lộc Ninh.","Thị trấn Lộc Ninh, Xã Lộc Thái, Xã Lộc Thuận",106.635,11.8389
tỉnh Đồng Nai,Lộc Quang,xã,28,2304,26314,105,"Ấp Vẻ Vang, xã Lộc Phú.","Xã Lộc Phú, Xã Lộc Hiệp, Xã Lộc Quang",106.716,11.8443
tỉnh Đồng Nai,Lộc Tấn,xã,28,2303,23697,183.36,"Ấp 5A, xã Lộc Tấn.","Xã Lộc Thiện, Xã Lộc Tấn",106.519,11.8815
tỉnh Đồng Nai,Lộc Thành,xã,28,2305,15338,206.1,"Ấp K'Liêu, xã Lộc Thành.","Xã Lộc Thịnh, Xã Lộc Thành",106.494,11.7661
tỉnh Đồng Nai,Lộc Thạnh,xã,28,2301,10339,125.5,"Ấp Thạnh Trung, xã Lộc Thạnh.","Xã Lộc Hòa, Xã Lộc Thạnh",106.576,11.9365
tỉnh Đồng Nai,Long Bình,phường,28,3123,26378,40.2,"Số 68 Thân Nhân Trung, khu phố 8, phường Long Bình.","Phường Hố Nai, Phường Tân Biên, Phường Long Bình",106.903,10.9318
tỉnh Đồng Nai,Long Hà,xã,28,2297,27614,168.4,"Thôn 8, xã Long Hà.","Xã Long Tân (huyện Phú Riềng), Xã Long Hà",106.815,11.7
tỉnh Đồng Nai,Long Hưng,phường,28,3155,74184,32.4,"Đường Nguyễn Văn Tỏ, khu phố Thái Hòa, phường Long Hưng.","Phường Long Bình Tân, Phường An Hòa, Xã Long Hưng (thành phố Biên Hòa)",106.867,10.881
tỉnh Đồng Nai,Long Khánh,phường,28,3157,7707,21.3,"Đường Cách Mạng Tháng Tám, phường Long Khánh.","Xã Xuân An, Xã Xuân Bình, Xã Xuân Hòa, Xã Phú Bình, Xã Bàu Trâm",107.288,10.9217
tỉnh Đồng Nai,Long Phước,xã,28,3150,42453,81.8,"Ấp Phước Hòa, xã Long Phước.","Xã Bàu Cạn, Xã Long Phước",107.056,10.7331
tỉnh Đồng Nai,Long Thành,xã,28,3144,15429,51.51,"Số 1 Trần Quốc Toản, xã Long Thành.","Thị trấn Long Thành, Xã Lộc An, Xã Bình Sơn (huyện Long Thành), Xã Long An",107.016,10.7824
tỉnh Đồng Nai,Minh Đức,xã,28,2312,16944,167.1,"Đường ĐT752, tổ 6, ấp 2, xã Minh Đức.","Xã An Phú, Xã Minh Tâm, Xã Minh Đức",106.522,11.6242
tỉnh Đồng Nai,Minh Hưng,phường,28,2330,34123,99.7,"Quốc lộ 13, khu phố 3B, phường Minh Hưng.","Phường Minh Long, Phường Minh Hưng",106.634,11.4845
tỉnh Đồng Nai,Nam Cát Tiên,xã,28,3173,15922,82.9,"Đường 774B Trà Cổ - Tà Lài, ấp 1, xã Nam Cát Tiên.","Xã Phú An, Xã Nam Cát Tiên",107.463,11.3837
tỉnh Đồng Nai,Nghĩa Trung,xã,28,2323,32897,222,"Quốc lộ 14, thôn 2, xã Nghĩa Trung.","Xã Đức Liễu, Xã Nghĩa Bình, Xã Nghĩa Trung",107.117,11.6841
tỉnh Đồng Nai,Nha Bích,xã,28,2326,22278,137.1,"Quốc lộ 14, ấp 5, xã Nha Bích.","Xã Minh Thắng, Xã Minh Lập, Xã Nha Bích",106.723,11.5064
tỉnh Đồng Nai,Nhơn Trạch,xã,28,3167,78589,108,"Đường Phạm Văn Thuận, ấp Xóm Hố, xã Phú Hội.","Thị trấn Hiệp Phước, Xã Long Tân (huyện Nhơn Trạch), Xã Phú Thạnh, Xã Phú Hội, Xã Phước Thiền",106.893,10.7372
tỉnh Đồng Nai,Phú Hòa,xã,28,3130,41306,71.8,"Khu dân cư 7, ấp 2, xã Phú Hòa.","Xã Phú Điền, Xã Phú Lợi, Xã Phú Hòa",107.419,11.2082
tỉnh Đồng Nai,Phú Lâm,xã,28,3125,33186,43.07,"Số 2713 quốc lộ 20, ấp Phú Tân, xã Phú Lâm.","Xã Thanh Sơn, Xã Phú Sơn (huyện Tân Phú), Xã Phú Bình, Xã Phú Lâm",107.502,11.3073
tỉnh Đồng Nai,Phú Lý,xã,28,3171,15992,279,"Đường 761, ấp 1, xã Phú Lý.",Không sáp nhập,107.146,11.404
tỉnh Đồng Nai,Phú Nghĩa,xã,28,2299,3392,279.4,Thôn Khắc Khoan.,"Xã Phú Văn, Xã Đức Hạnh, Xã Phú Nghĩa",107.018,11.9338
tỉnh Đồng Nai,Phú Riềng,xã,28,2298,36232,117.4,"Thôn Tân Bình, xã Phú Riềng.","Xã Bù Nho, Xã Phú Riềng",106.922,11.6825
tỉnh Đồng Nai,Phú Trung,xã,28,2317,13585,172,"Thôn Phú Tâm, xã Phú Trung.","Xã Phước Tân, Xã Phú Trung",107.017,11.7238
tỉnh Đồng Nai,Phú Vinh,xã,28,3129,31328,69.5,"Đường quốc lộ 20, khu 1, ấp 5, xã Phú Vinh.","Xã Phú Tân, Xã Phú Vinh",107.359,11.2595
tỉnh Đồng Nai,Phước An,xã,28,3169,51088,170.7,"Đường Hùng Vương, ấp Bàu Bông, xã Phước An.","Xã Phước An (huyện Nhơn Trạch), Xã Vĩnh Thanh, Xã Long Thọ",106.932,10.6572
tỉnh Đồng Nai,Phước Bình,phường,28,2294,44771,72.6,"Tòa nhà B3, Trung tâm hành chính phường Phước Bình.","Phường Long Phước, Phường Phước Bình, Xã Bình Sơn (huyện Phú Riềng), Xã Long Giang",106.94,11.834
tỉnh Đồng Nai,Phước Long,phường,28,2293,đang cập nhật,71.8838,"Đường Lý Thái Tổ, phường Phước Long.","Phường Long Thủy, Phường Thác Mơ, Phường Sơn Giang, Xã Phước Tín",107.018,11.819
tỉnh Đồng Nai,Phước Sơn,xã,28,2324,31005,386.6,"Thôn 3, xã Phước Sơn.","Xã Đăng Hà, Xã Thống Nhất, Xã Phước Sơn",107.223,11.6254
tỉnh Đồng Nai,Phước Tân,phường,28,3146,64181,42.8,"1393 quốc lộ 51, khu phố Hương Phước, phường Phước Tân.",Không sáp nhập,106.946,10.9137
tỉnh Đồng Nai,Phước Thái,xã,28,3151,55914,85.9,"Ấp Long Phú, xã Phước Thái.","Xã Tân Hiệp (huyện Long Thành), Xã Phước Bình, Xã Phước Thái",107.068,10.6861
tỉnh Đồng Nai,Sông Ray,xã,28,3143,31346,65.6,"Ấp 1, xã Sông Ray.","Xã Lâm San, Xã Sông Ray",107.335,10.7248
tỉnh Đồng Nai,Tà Lài,xã,28,3174,34158,83.3,"Ấp 4, xã Tà Lài.","Xã Phú Thịnh, Xã Phú Lập, Xã Tà Lài",107.391,11.3537
tỉnh Đồng Nai,Tam Hiệp,phường,28,3153,139441,10.8,"Đường Trần Quốc Toản, tổ 29C, khu phố 3, phường Tam Hiệp.","Phường Tân Hiệp, Phường Tân Mai, Phường Bình Đa, Phường Tam Hiệp",106.859,10.9538
tỉnh Đồng Nai,Tam Phước,phường,28,3145,48313,45.1,"Quốc lộ 51, khu phố Long Đức 3, phường Tam Phước.",Không sáp nhập,106.958,10.8813
tỉnh Đồng Nai,Tân An,xã,28,3127,41922,40.61,"Ấp 2, xã Tân An.","Xã Vĩnh Tân, Xã Tân An",106.973,11.0352
tỉnh Đồng Nai,Tân Hưng,xã,28,2311,35222,92.41,"Đường ĐT 756, xã Tân Hưng.","Xã Tân Hưng (huyện Hớn Quản), Xã An Khương, Xã Thanh An",106.715,11.6919
tỉnh Đồng Nai,Tân Khai,xã,28,2314,3614,161.8,"Khu phố 1, xã Tân Khai.","Thị trấn Tân Khai, Xã Tân Hiệp (huyện Hớn Quản), Xã Đồng Nơ",106.542,11.5279
tỉnh Đồng Nai,Tân Lợi,xã,28,2328,22774,379.8,"Đường liên xã Tân Hòa - Tân Lợi, ấp Trăng Tranh, xã Tân Lợi.","Xã Tân Hưng, Xã Tân Lợi (huyện Đồng Phú), Xã Tân Hòa",106.991,11.4329
tỉnh Đồng Nai,Tân Phú,xã,28,3161,3136,38.6,"Số 789 Chu Văn An, ấp 7, xã Tân Phú.","Thị trấn Tân Phú (huyện Tân Phú), Xã Phú Lộc, Xã Trà Cổ, Xã Phú Thanh, Xã Phú Xuân",107.441,11.275
tỉnh Đồng Nai,Tân Quan,xã,28,2313,30385,148.3,"Ấp Văn Hiên 2, xã Tân Quan.","Xã Phước An, Xã Tân Lợi (huyện Hớn Quản), Xã Quang Minh, Xã Tân Quan",106.669,11.6046
tỉnh Đồng Nai,Tân Tiến,xã,28,2302,33994,207.2,"Đường ĐT 759B, ấp Tân Định, xã Tân Tiến.","Xã Tân Thành, Xã Tân Tiến (huyện Bù Đốp), Xã Lộc An (huyện Lộc Ninh)",106.656,11.9268
tỉnh Đồng Nai,Tân Triều,phường,28,3122,101608,63.3,"Đường 768, ấp 2, xã Thạnh Phú.","Phường Tân Phong, Xã Tân Bình, Xã Bình Lợi, Xã Thạnh Phú",106.82,11.0064
tỉnh Đồng Nai,Thanh Sơn,xã,28,3128,33342,315.4,"Đường ĐT 776, tổ 11, ấp 2, xã Thanh Sơn.",Không sáp nhập,107.256,11.2977
tỉnh Đồng Nai,Thiện Hưng,xã,28,2307,35041,111,"Đường Lê Hồng Phong, ấp Thanh Xuân, xã Thiện Hưng.","Thị trấn Thanh Bình, Xã Thanh Hòa, Xã Thiện Hưng",106.798,11.9688
tỉnh Đồng Nai,Thọ Sơn,xã,28,2321,21457,307.7,"Quốc lộ 14, thôn Sơn Lợi, xã Thọ Sơn.","Xã Phú Sơn (huyện Bù Đăng), Xã Đồng Nai, Xã Thọ Sơn",107.335,11.8627
tỉnh Đồng Nai,Thống Nhất,xã,28,3132,71665,120.1,"Quốc lộ 20, ấp Đức Long 2, xã Thống Nhất.","Xã Gia Tân 1, Xã Gia Tân 2, Xã Phú Cường, Xã Phú Túc",107.148,11.1119
tỉnh Đồng Nai,Thuận Lợi,xã,28,2315,23655,167.2,"Đường ĐT 741, ấp 1, xã Thuận Lợi.","Xã Thuận Phú, Xã Thuận Lợi",106.867,11.6055
tỉnh Đồng Nai,Trấn Biên,phường,28,3154,197060,31,"Số 63 Võ Thị Sáu, khu phố 11, phường Trấn Biên.","Phường Bửu Long, Phường Quang Vinh, Phường Trung Dũng, Phường Thống Nhất, Phường Hiệp Hòa, Phường An Bình",106.835,10.938
tỉnh Đồng Nai,Trảng Bom,xã,28,3133,92712,68.8,"Đường Nguyễn Hữu Cảnh, khu phố 3, xã Trảng Bom.","Thị trấn Trảng Bom, Xã Quảng Tiến, Xã Sông Trầu, Xã Giang Điền",107.016,10.9721
tỉnh Đồng Nai,Trảng Dài,phường,28,3121,104972,37.3,"Số 462 Bùi Trọng Nghĩa, khu phố 3A, phường Trảng Dài.","Phường Trảng Dài, Xã Thiện Tân",106.883,11.0028
tỉnh Đồng Nai,Trị An,xã,28,3126,51028,660.5,"Đường Nguyễn Tất Thành, khu phố 2, thị trấn Vĩnh An.","Thị trấn Vĩnh An, Xã Mã Đà, Xã Trị An",107.041,11.2169
tỉnh Đồng Nai,Xuân Bắc,xã,28,3162,44866,96.4,"Ấp 2B, xã Xuân Bắc.","Xã Suối Nho, Xã Xuân Bắc",107.301,11.0404
tỉnh Đồng Nai,Xuân Định,xã,28,3166,3687,52.3,"Quốc lộ 1, ấp Bảo Định, xã Xuân Định.","Xã Xuân Bảo, Xã Bảo Hòa, Xã Xuân Định",107.286,10.8765
tỉnh Đồng Nai,Xuân Đông,xã,28,3142,47623,108,"Ấp Bể Bạc, xã Xuân Đông.","Xã Xuân Tây, Xã Xuân Đông, Xã Xuân Tâm",107.358,10.8054
tỉnh Đồng Nai,Xuân Đường,xã,28,3141,26565,82.1,"Ấp 3, xã Thừa Đức.","Xã Cẩm Đường, Xã Thừa Đức, Xã Xuân Đường",107.143,10.776
tỉnh Đồng Nai,Xuân Hòa,xã,28,3164,78491,306,"Tổ 1, ấp 3, đường quốc lộ 1A, xã Xuân Hòa.","Xã Xuân Hưng, Xã Xuân Hòa, Xã Xuân Tâm (phần còn lại sau khi sáp nhập vào xã Xuân Đông)",107.493,10.8661
tỉnh Đồng Nai,Xuân Lập,phường,28,3149,18947,29.2,"Quốc lộ 1, khu phố Bàu Sen, phường Xuân Lập.","Phường Bàu Sen, Phường Xuân Lập",107.192,10.9139
tỉnh Đồng Nai,Xuân Lộc,xã,28,3152,104304,140.5,"Số 8 Hoàng Văn Thụ, khu phố 1, xã Xuân Lộc.","Thị trấn Gia Ray, Xã Xuân Thọ, Xã Xuân Trường, Xã Suối Cát, Xã Xuân Hiệp",107.387,10.9379
tỉnh Đồng Nai,Xuân Phú,xã,28,3165,29608,55.6,"Quốc lộ 1, ấp Bình Tân, xã Xuân Phú, tỉnh Đồng Nai.","Xã Lang Minh, Xã Xuân Phú",107.345,10.8865
tỉnh Đồng Nai,Xuân Quế,xã,28,3140,21189,92.9,"Ấp 2, xã Xuân Quế.","Xã Sông Nhạn, Xã Xuân Quế",107.139,10.8433
tỉnh Đồng Nai,Xuân Thành,xã,28,3163,22007,122.7,"Tỉnh lộ 766, ấp Tân Hòa, xã Xuân Thành.","Xã Suối Cao, Xã Xuân Thành",107.392,11.0097
