tentinh,tenxa,loai,matinh,maxa,danso,dientich_km2,trungtam_hc,truoc_sapnhap,kinhdo,vido
tỉnh Lai Châu,Bản Bo,xã,14,2085,9496,100.82,"Trụ sở UBND xã Bản Bo, Bản Hưng Phong, xã Bản Bo","Xã Nà Tăm, Xã Bản Bo",103.697,22.2846
tỉnh Lai Châu,Bình Lư,xã,14,2083,18606,173.91,"Số 170 Đường Võ Nguyên Giáp, xã Bình Lư","Thị trấn Tam Đường, Xã Sơn Bình, Xã Bình Lư",103.678,22.3532
tỉnh Lai Châu,Bum Nưa,xã,14,2093,7147,315.13,"Bản Nà Hẻ, xã Bum Nưa","Xã Pa Vệ Sủ, Xã Bum Nưa",102.85,22.4925
tỉnh Lai Châu,Bum Tở,xã,14,2090,11711,384.07,"Khu 8, xã Bum Tở","Thị trấn Mường Tè, Xã Can Hồ, Xã Bum Tở",102.791,22.3407
tỉnh Lai Châu,Dào San,xã,14,2107,16123,137.29,"Bản Hợp 2, xã Dào San","Xã Tung Qua Lìn, Xã Mù Sang, Xã Dào San",103.361,22.6637
tỉnh Lai Châu,Đoàn Kết,phường,14,2081,25403,134.31,"Số 68, Đường Võ Giáp, Phường Đoàn Kết","Phường Đoàn Kết, Phường Quyết Tiến, Phường Quyết Thắng, Xã Lản Nhì Thàng, Xã Sùng Phài",103.397,22.4412
tỉnh Lai Châu,Hồng Thu,xã,14,2099,13368,178,"Bản Nậm Mạ Thái, xã Hồng Thu","Xã Phìn Hồ, Xã Ma Quai, Xã Hồng Thu",103.322,22.4203
tỉnh Lai Châu,Hua Bum,xã,14,2091,5697,355.72,"Bản Chang Chảo Pá, xã Hua Bum","Xã Vàng San, Xã Hua Bum",102.98,22.3565
tỉnh Lai Châu,Khoen On,xã,14,2117,10677,189.78,"Bản Củng, xã Khoen On","Xã Ta Gia, Xã Khoen On",103.854,21.7686
tỉnh Lai Châu,Khổng Lào,xã,14,2108,16924,188.12,"Bản Khổng Lào, xã Khổng Lào","Xã Hoang Thèn, Xã Bản Lang, Xã Khổng Lào",103.372,22.5935
tỉnh Lai Châu,Khun Há,xã,14,2084,9148,149.35,"Trụ sở xã Khun Há, bản Nậm Đích, xã Khun Há","Xã Bản Hon, Xã Khun Há",103.583,22.2581
tỉnh Lai Châu,Lê Lợi,xã,14,2097,911,288.36,"Bản Chiềng Chăn 3, xã Lê Lợi","Xã Nậm Pì, Xã Pú Đao, Xã Chăn Nưa, Xã Lê Lợi",103.154,22.1699
tỉnh Lai Châu,Mù Cả,xã,14,2089,3299,384.04,"Bản Mù Cả, xã Mù Cả",Không sáp nhập,102.459,22.4844
tỉnh Lai Châu,Mường Khoa,xã,14,2112,12529,168.83,"Bản Phiêng Tâm, xã Mường Khoa","Xã Phúc Khoa, Xã Mường Khoa",103.654,22.1773
tỉnh Lai Châu,Mường Kim,xã,14,2116,20385,316.32,"Bản Nà Đình, xã Mường Kim","Xã Tà Mung, Xã Tà Hừa, Xã Pha Mu, Xã Mường Kim",103.798,21.8809
tỉnh Lai Châu,Mường Mô,xã,14,2094,7335,395.16,"Bản Mường Mô, xã Mường Mô","Xã Nậm Chà, Xã Mường Mô",102.868,22.1502
tỉnh Lai Châu,Mường Tè,xã,14,2088,6364,292,"Bản Bó, xã Mường Tè","Xã Nậm Khao, Xã Mường Tè",102.63,22.482
tỉnh Lai Châu,Mường Than,xã,14,2115,13925,154.08,"Bản Nậm Ngùa, xã Mường Than","Xã Phúc Than, Xã Mường Mít",103.861,22.0198
tỉnh Lai Châu,Nậm Cuổi,xã,14,2104,10799,177.16,"Bản Tân Lập, xã Nậm Cuổi","Xã Nậm Hăn, Xã Nậm Cuổi",103.503,22.0735
tỉnh Lai Châu,Nậm Hàng,xã,14,2095,11218,335.92,"TDP Pá Kéo, xã Nậm Hàng","Thị trấn Nậm Nhùn, Xã Nậm Manh, Xã Nậm Hàng",103.019,22.145
tỉnh Lai Châu,Nậm Mạ,xã,14,2102,6504,112.73,"Bản Căn Co, xã Nậm Mạ","Xã Căn Co, Xã Nậm Mạ",103.425,22.1516
tỉnh Lai Châu,Nậm Sỏ,xã,14,2113,đang cập nhật,263.35,"Bản Nà Ngò, xã Nậm Sỏ","Xã Tà Mít, Xã Nậm Sỏ",103.596,22.085
tỉnh Lai Châu,Nậm Tăm,xã,14,2100,12753,242.28,"Bản Nà Tăm 1, xã Nậm Tăm","Xã Lùng Thàng, Xã Nậm Cha, Xã Nậm Tăm",103.382,22.2929
tỉnh Lai Châu,Pa Tần,xã,14,2098,9039,316.53,"Bản Pa Tần 3, xã Pa Tần","Xã Nậm Ban, Xã Trung Chải, Xã Pa Tần",103.123,22.415
tỉnh Lai Châu,Pa Ủ,xã,14,2087,6084,444.58,"Bản Tham Pa, xã Pa Ủ","Xã Tá Bạ, Xã Pa Ủ",102.649,22.6252
tỉnh Lai Châu,Pắc Ta,xã,14,2114,10704,168.58,"Trụ sở UBND xã - bản Pắc Ta, xã Pắc Ta","Xã Hố Mít, Xã Pắc Ta",103.859,22.0992
tỉnh Lai Châu,Phong Thổ,xã,14,2105,23295,266.71,"Đường Võ Nguyên Giáp, TDP Hữu Nghị, xã Phong Thổ","Thị trấn Phong Thổ, Xã Huổi Luông, Xã Ma Li Pho, Xã Mường So",103.269,22.5296
tỉnh Lai Châu,Pu Sam Cáp,xã,14,2101,11611,152.23,"Bản Noong Hẻo 2, xã Pu Sam Cáp","Xã Pa Khóa, Xã Noong Hẻo, Xã Pu Sam Cáp",103.493,22.2263
tỉnh Lai Châu,Sì Lở Lầu,xã,14,2106,16196,147.8,"Bản Mồ Sì San, xã Sì Lở Lầu","Xã Vàng Ma Chải, Xã Mồ Sì San, Xã Pa Vây Sử, Xã Sì Lở Lầu",103.36,22.7547
tỉnh Lai Châu,Sìn Hồ,xã,14,2096,14012,159.68,"Khu 3, xã Sìn Hồ","Thị trấn Sìn Hồ, Xã Sà Dề Phìn, Xã Phăng Sô Lin, Xã Tả Phìn",103.226,22.3263
tỉnh Lai Châu,Sin Suối Hồ,xã,14,2109,16338,255.91,"Bản Đông Phong, xã Sin Suối Hồ","Xã Nậm Xe, Xã Thèn Sin, Xã Sin Suối Hồ",103.492,22.5207
tỉnh Lai Châu,Tả Lèng,xã,14,2082,12628,128.36,"Bản Giang Ma, xã Tả Lèng","Xã Giang Ma, Xã Hồ Thầu, Xã Tả Lèng",103.558,22.4009
tỉnh Lai Châu,Tà Tổng,xã,14,2092,7967,512.01,"Bản Tà Tổng, xã Tà Tổng",Không sáp nhập,102.604,22.3233
tỉnh Lai Châu,Tân Phong,phường,14,2080,36456,106.77,"Phố Trần Đại nghĩa, Tổ 26, Phường Tân Phong, tỉnh Lai Châu","Phường Tân Phong, Phường Đông Phong, Xã San Thàng, Xã Nùng Nàng, Xã Bản Giang",103.485,22.3534
tỉnh Lai Châu,Tân Uyên,xã,14,2111,30415,296.25,"TDP số 26, xã Tân Uyên","Thị trấn Tân Uyên, Xã Trung Đồng, Xã Thân Thuộc, Xã Nậm Cần",103.751,22.1433
tỉnh Lai Châu,Than Uyên,xã,14,2110,27283,132.09,"Khu 2, xã Than Uyên","Thị trấn Than Uyên, Xã Mường Than, Xã Hua Nà, Xã Mường Cang",103.884,21.957
tỉnh Lai Châu,Thu Lũm,xã,14,2086,5255,251.55,"Bản Mé Gióng, xã Thu Lũm","Xã Ka Lăng, Xã Thu Lũm",102.448,22.6474
tỉnh Lai Châu,Tủa Sín Chải,xã,14,2103,16199,292.88,"Bản Nhiều Sáng, xã Tủa Sín Chải","Xã Làng Mô, Xã Tả Ngảo, Xã Tủa Sín Chải",103.273,22.2005
