tentinh,tenxa,loai,matinh,maxa,danso,dientich_km2,trungtam_hc,truoc_sapnhap,kinhdo,vido
tỉnh Thái Nguyên,An Khánh,xã,10,1139,20104,45.09,"Trụ sở Đảng ủy, HĐND, UBND xã Cù Vân","Xã Cù Vân, Xã Hà Thượng, Xã An Khánh",105.722,21.6276
tỉnh Thái Nguyên,Ba Bể,xã,10,1104,11773,148.08,"Trụ sở Đảng ủy, HĐND, UBND xã Khang Ninh","Xã Cao Thượng, Xã Nam Mẫu, Xã Khang Ninh",105.627,22.4387
tỉnh Thái Nguyên,Bá Xuyên,phường,10,1146,20065,21.13,"Trụ sở Đảng ủy, HĐND, UBND xã Bá Xuyên","Phường Mỏ Chè, Phường Châu Sơn, Xã Bá Xuyên",105.806,21.4666
tỉnh Thái Nguyên,Bắc Kạn,phường,10,1194,25387,72,"Trụ sở Đảng ủy, HĐND, UBND Thành ủy - HĐND - UBND TP Bắc Kạn","Phường Sông Cầu, Phường Phùng Chí Kiên, Phường Xuất Hóa, Xã Nông Thượng",105.86,22.1085
tỉnh Thái Nguyên,Bách Quang,phường,10,1144,26668,35.02,"Trụ sở Đảng ủy, HĐND, UBND phường Bách Quang","Phường Lương Sơn, Phường Bách Quang, Xã Tân Quang",105.869,21.4954
tỉnh Thái Nguyên,Bạch Thông,xã,10,1212,8251,127.84,"Trụ sở Đảng ủy, HĐND, UBND xã Dương Phong","Xã Đồng Thắng, Xã Dương Phong, Xã Quang Thuận",105.719,22.1255
tỉnh Thái Nguyên,Bằng Thành,xã,10,1099,13984,208.22,"Trụ sở Đảng ủy, HĐND, UBND huyện Pác Nặm","Xã Bộc Bố, Xã Nhạn Môn, Xã Giáo Hiệu, Xã Bằng Thành",105.671,22.6576
tỉnh Thái Nguyên,Bằng Vân,xã,10,1112,5643,133.01,"Trụ sở Đảng ủy, HĐND, UBND xã Bằng Vân","Xã Thượng Ân, Xã Bằng Vân",106.052,22.508
tỉnh Thái Nguyên,Bình Thành,xã,10,1161,32182,72.1,"Trụ sở Đảng ủy, HĐND, UBND xã Bình Thành","Xã Sơn Phú, Xã Bình Thành",105.571,21.7878
tỉnh Thái Nguyên,Bình Yên,xã,10,1142,16106,48.36,"Trụ sở Đảng ủy, HĐND, UBND xã Bình Yên","Xã Trung Lương, Xã Định Biên, Xã Thanh Định, Xã Bình Yên",105.573,21.8597
tỉnh Thái Nguyên,Cẩm Giàng,xã,10,1117,11342,110.79,"Trụ sở Đảng ủy, HĐND, UBND xã Cẩm Giàng","Xã Quân Hà, Xã Nguyên Phúc, Xã Mỹ Thanh, Xã Cẩm Giàng",105.895,22.1881
tỉnh Thái Nguyên,Cao Minh,xã,10,1100,12807,134.89,"Trụ sở Đảng ủy, HĐND, UBND xã Cổ Linh","Xã Công Bằng, Xã Cổ Linh, Xã Cao Tân",105.645,22.5405
tỉnh Thái Nguyên,Chợ Đồn,xã,10,1118,16252,142.1,"Trụ sở Đảng ủy, HĐND, UBND xã Chợ Đồn","Thị trấn Bằng Lũng, Xã Ngọc Phái, Xã Phương Viên, Xã Bằng Lãng",105.595,22.1731
tỉnh Thái Nguyên,Chợ Mới,xã,10,1196,80832,50.43,"Trụ sở Đảng ủy, HĐND, UBND huyện Chợ Mới","Thị trấn Đồng Tâm, Xã Quảng Chu, Xã Như Cố",105.823,21.8769
tỉnh Thái Nguyên,Chợ Rã,xã,10,1102,14507,92.81,"Trụ sở Đảng ủy, HĐND, UBND huyện Ba Bể","Thị trấn Chợ Rã, Xã Thượng Giáo, Xã Địa Linh",105.726,22.4395
tỉnh Thái Nguyên,Côn Minh,xã,10,1203,6635,146.26,"Trụ sở Đảng ủy, HĐND, UBND xã Quang Phong","Xã Quang Phong, Xã Dương Sơn, Xã Côn Minh",106.025,22.1038
tỉnh Thái Nguyên,Cường Lợi,xã,10,1202,5731,117.85,"Trụ sở Đảng ủy, HĐND, UBND xã Cường Lợi","Xã Văn Vũ, Xã Cường Lợi",106.173,22.3151
tỉnh Thái Nguyên,Đại Phúc,xã,10,1128,3922,107.47,"Trụ sở Đảng ủy, HĐND, UBND xã Phúc Xuân","Thị trấn Hùng Sơn, Xã Phúc Xuân, Xã Phúc Trìu, Xã Tân Thái, Xã Phúc Tân",105.709,21.5765
tỉnh Thái Nguyên,Đại Từ,xã,10,1138,27021,69.42,"Trụ sở Đảng ủy, HĐND, UBND xã Bình Thuận","Xã Bình Thuận, Xã Khôi Kỳ, Xã Mỹ Yên, Xã Lục Ba",105.615,21.6069
tỉnh Thái Nguyên,Dân Tiến,xã,10,1168,1939,144.28,"Trụ sở Đảng ủy, HĐND, UBND xã Dân Tiến","Xã Bình Long, Xã Phương Giao, Xã Dân Tiến",106.163,21.6767
tỉnh Thái Nguyên,Điềm Thụy,xã,10,1192,4186,42.03,"Trụ sở Đảng ủy, HĐND, UBND xã Điềm Thụy","Xã Hà Châu, Xã Nga My, Xã Điềm Thụy, Xã Thượng Đình",105.921,21.4567
tỉnh Thái Nguyên,Định Hóa,xã,10,1147,22333,67.3,"Trụ sở Đảng ủy, HĐND, UBND huyện Định Hóa hiện nay","Thị trấn Chợ Chu, Xã Phúc Chu, Xã Bảo Linh, Xã Đồng Thịnh",105.6,21.9019
tỉnh Thái Nguyên,Đồng Hỷ,xã,10,1170,31012,53.72,"Trụ sở Đảng ủy, HĐND, UBND huyện Đồng Hỷ hiện nay","Thị trấn Hóa Thượng, Thị trấn Sông Cầu, Xã Minh Lập, Xã Hóa Trung",105.834,21.6732
tỉnh Thái Nguyên,Đồng Phúc,xã,10,1109,11722,199.11,"Trụ sở Đảng ủy, HĐND, UBND xã Đồng Phúc","Xã Quảng Khê, Xã Hoàng Trĩ, Xã Bằng Phúc, Xã Đồng Phúc",105.701,22.3125
tỉnh Thái Nguyên,Đức Lương,xã,10,1141,13181,60.9,"Trụ sở Đảng ủy, HĐND, UBND xã Đức Lương","Xã Minh Tiến, Xã Phúc Lương, Xã Đức Lương",105.61,21.7381
tỉnh Thái Nguyên,Đức Xuân,phường,10,1195,2266,34.46,"Trụ sở Đảng ủy, HĐND, UBND tại Sở Tài chính Bắc Kạn cũ","Phường Nguyễn Thị Minh Khai, Phường Huyền Tụng, Phường Đức Xuân",105.85,22.1658
tỉnh Thái Nguyên,Gia Sàng,phường,10,1127,44094,25.47,"Trụ sở Đảng ủy, HĐND, UBND phường Cam Giá","Phường Hương Sơn, Xã Đồng Liên, Phường Gia Sàng, Phường Cam Giá",105.882,21.5621
tỉnh Thái Nguyên,Hiệp Lực,xã,10,1114,7317,105.02,"Trụ sở Đảng ủy, HĐND, UBND xã Hiệp Lực","Xã Thuần Mang, Xã Hiệp Lực",105.968,22.3273
tỉnh Thái Nguyên,Hợp Thành,xã,10,1152,10828,41.2,"Trụ sở Đảng ủy, HĐND, UBND xã Phủ Lý","Xã Ôn Lương, Xã Phủ Lý, Xã Hợp Thành",105.66,21.7674
tỉnh Thái Nguyên,Kha Sơn,xã,10,1193,4224,37.85,"Trụ sở Đảng ủy, HĐND, UBND xã Phú Lương","Xã Lương Phú, Xã Tân Đức, Xã Thanh Ninh, Xã Dương Thành, Xã Kha Sơn",106.006,21.4277
tỉnh Thái Nguyên,Kim Phượng,xã,10,1160,11104,78.61,"Trụ sở Đảng ủy, HĐND, UBND xã Kim Phượng","Xã Quy Kỳ, Xã Kim Phượng",105.626,21.9675
tỉnh Thái Nguyên,La Bằng,xã,10,1137,18237,60.84,"Trụ sở Đảng ủy, HĐND, UBND xã Hoàng Nông","Xã Hoàng Nông, Xã Tiên Hội, Xã La Bằng",105.561,21.6225
tỉnh Thái Nguyên,La Hiên,xã,10,1166,12269,71.55,"Trụ sở Đảng ủy, HĐND, UBND xã La Hiên","Xã Cúc Đường, Xã La Hiên",105.948,21.7416
tỉnh Thái Nguyên,Lam Vỹ,xã,10,1159,8073,71.42,"Trụ sở Đảng ủy, HĐND, UBND xã Lam Vỹ","Xã Linh Thông, Xã Lam Vỹ",105.692,21.9977
tỉnh Thái Nguyên,Linh Sơn,phường,10,1133,46733,39.28,"Trụ sở Đảng ủy, HĐND, UBND phường Đồng Bẩm","Phường Chùa Hang, Phường Đồng Bẩm, Xã Cao Ngạn, Xã Huống Thượng, Xã Linh Sơn",105.857,21.6131
tỉnh Thái Nguyên,Nà Phặc,xã,10,1110,9231,101.18,"Trụ sở Đảng ủy, HĐND, UBND thị trấn Nà Phặc","Thị trấn Nà Phặc, Xã Trung Hòa",105.904,22.402
tỉnh Thái Nguyên,Na Rì,xã,10,1200,11494,112.73,"Trụ sở Đảng ủy, HĐND, UBND thị trấn Yến Lạc","Thị trấn Yến Lạc, Xã Sơn Thành, Xã Kim Lư",106.179,22.2152
tỉnh Thái Nguyên,Nam Cường,xã,10,1119,10793,149.65,"Trụ sở Đảng ủy, HĐND, UBND xã Nam Cường","Xã Xuân Lạc, Xã Đồng Lạc, Xã Nam Cường",105.564,22.3437
tỉnh Thái Nguyên,Nam Hòa,xã,10,1156,16237,65.02,"Trụ sở Đảng ủy, HĐND, UBND xã Nam Hòa","Xã Cây Thị, Xã Nam Hòa",105.993,21.6498
tỉnh Thái Nguyên,Ngân Sơn,xã,10,1113,826,145.57,"Trụ sở Đảng ủy, HĐND, UBND xã Ngân Sơn","Thị trấn Vân Tùng, Xã Cốc Đán, Xã Đức Vân",106,22.4354
tỉnh Thái Nguyên,Nghĩa Tá,xã,10,1123,7787,166.89,"Trụ sở Đảng ủy, HĐND, UBND xã Nghĩa Tá","Xã Lương Bằng, Xã Bình Trung, Xã Nghĩa Tá",105.527,22.053
tỉnh Thái Nguyên,Nghiên Loan,xã,10,1101,1104,130.33,"Trụ sở Đảng ủy, HĐND, UBND xã Nghiên Loan","Xã Xuân La, Xã An Thắng, Xã Nghiên Loan",105.722,22.5527
tỉnh Thái Nguyên,Nghinh Tường,xã,10,1164,6554,160.73,"Trụ sở Đảng ủy, HĐND, UBND xã Nghinh Tường","Xã Vũ Chấn, Xã Nghinh Tường",106.06,21.8491
tỉnh Thái Nguyên,Phan Đình Phùng,phường,10,1126,111482,14.73,"Trụ sở Đảng ủy, HĐND, UBND","Phường Trưng Vương, Phường Túc Duyên, Phường Đồng Quang, Phường Quang Trung, Phường Hoàng Văn Thụ, Phường Tân Thịnh, Phường Phan Đình Phùng, Phường Gia Sàng",105.834,21.5887
tỉnh Thái Nguyên,Phổ Yên,phường,10,1175,49162,40.7,"Trụ sở Đảng ủy, HĐND, UBND TP Phổ Yên","Phường Ba Hàng, Phường Hồng Tiến, Phường Bãi Bông, Xã Đắc Sơn",105.867,21.4265
tỉnh Thái Nguyên,Phong Quang,xã,10,1213,6144,153.46,"Trụ sở Đảng ủy, HĐND, UBND xã Dương Quang","Xã Dương Quang, Xã Đôn Phong",105.756,22.2038
tỉnh Thái Nguyên,Phú Bình,xã,10,1188,44845,44.18,"Trụ sở Đảng ủy, HĐND, UBND tại Huyện ủy Phú Bình","Thị trấn Hương Sơn, Xã Xuân Phương, Xã Úc Kỳ, Xã Nhã Lộng, Xã Bảo Lý, Xã Thượng Đình",105.956,21.4735
tỉnh Thái Nguyên,Phú Đình,xã,10,1150,11746,47.89,"Trụ sở Đảng ủy, HĐND, UBND xã Phú Đình","Xã Điềm Mặc, Xã Phú Đình",105.528,21.8089
tỉnh Thái Nguyên,Phú Lạc,xã,10,1135,21105,58.07,"Trụ sở Đảng ủy, HĐND, UBND xã Tân Linh","Xã Phục Linh, Xã Tân Linh, Xã Phú Lạc",105.652,21.6838
tỉnh Thái Nguyên,Phú Lương,xã,10,1158,43914,112.39,"Trụ sở Đảng ủy, HĐND, UBND huyện Phú Lương hiện nay","Thị trấn Đu, Thị trấn Giang Tiên, Xã Yên Lạc, Xã Động Đạt",105.726,21.744
tỉnh Thái Nguyên,Phú Thịnh,xã,10,1136,21333,45.37,"Trụ sở Đảng ủy, HĐND, UBND xã Bản Ngoại","Xã Bản Ngoại, Xã Phú Cường, Xã Phú Thịnh",105.553,21.708
tỉnh Thái Nguyên,Phủ Thông,xã,10,1115,1332,96.94,"Trụ sở Đảng ủy, HĐND, UBND xã Phủ Thông","Thị trấn Phủ Thông, Xã Vi Hương, Xã Tân Tú, Xã Lục Bình",105.851,22.2673
tỉnh Thái Nguyên,Phú Xuyên,xã,10,1173,23053,64.58,"Trụ sở Đảng ủy, HĐND, UBND xã Yên Lãng","Xã Yên Lãng, Xã Phú Xuyên",105.52,21.6758
tỉnh Thái Nguyên,Phúc Lộc,xã,10,1103,28236,70.5,"Trụ sở Đảng ủy, HĐND, UBND xã Phúc Lộc","Xã Bành Trạch, Xã Hà Hiệu, Xã Phúc Lộc",105.825,22.4712
tỉnh Thái Nguyên,Phúc Thuận,phường,10,1176,29051,74.16,"Trụ sở Đảng ủy, HĐND, UBND phường Bắc Sơn","Phường Bắc Sơn, Xã Minh Đức, Xã Phúc Thuận",105.765,21.4521
tỉnh Thái Nguyên,Phượng Tiến,xã,10,1148,13312,102.7,"Trụ sở Đảng ủy, HĐND, UBND xã Tân Dương","Xã Tân Dương, Xã Tân Thịnh, Xã Phượng Tiến",105.709,21.9244
tỉnh Thái Nguyên,Quân Chu,xã,10,1134,13096,79.38,"Trụ sở Đảng ủy, HĐND, UBND thị trấn Quân Chu","Thị trấn Quân Chu, Xã Cát Nê",105.681,21.4922
tỉnh Thái Nguyên,Quan Triều,phường,10,1125,42292,24.72,"Trụ sở Đảng ủy, HĐND, UBND phường Tân Long","Phường Tân Long, Phường Quang Vinh, Phường Quan Triều, Xã Sơn Cẩm",105.795,21.6301
tỉnh Thái Nguyên,Quảng Bạch,xã,10,1120,3815,75.22,"Trụ sở Đảng ủy, HĐND, UBND xã Quảng Bạch","Xã Tân Lập, Xã Quảng Bạch",105.604,22.2692
tỉnh Thái Nguyên,Quang Sơn,xã,10,1172,10837,58.63,"Trụ sở Đảng ủy, HĐND, UBND xã Quang Sơn","Xã Tân Long, Xã Quang Sơn",105.877,21.7356
tỉnh Thái Nguyên,Quyết Thắng,phường,10,1129,29933,24.43,"Trụ sở Đảng ủy, HĐND, UBND phường Thịnh Đán","Phường Thịnh Đán, Xã Phúc Hà, Xã Quyết Thắng",105.794,21.5819
tỉnh Thái Nguyên,Sảng Mộc,xã,10,1169,3286,96.79,"Trụ sở Đảng ủy, HĐND, UBND xã Sảng Mộc",Không sáp nhập,106.004,21.9018
tỉnh Thái Nguyên,Sông Công,phường,10,1143,21039,13.98,"Trụ sở Đảng ủy, HĐND, UBND Thành ủy Sông Công hiện nay","Phường Thắng Lợi, Phường Phố Cò, Phường Cải Đan",105.849,21.4579
tỉnh Thái Nguyên,Tân Cương,xã,10,1131,25525,57.92,"Trụ sở Đảng ủy, HĐND, UBND xã Tân Cương","Xã Thịnh Đức, Xã Bình Sơn, Xã Tân Cương",105.787,21.5194
tỉnh Thái Nguyên,Tân Khánh,xã,10,1190,23724,48.31,"Trụ sở Đảng ủy, HĐND, UBND xã Tân Khánh","Xã Bàn Đạt, Xã Đào Xá, Xã Tân Khánh",105.941,21.5446
tỉnh Thái Nguyên,Tân Kỳ,xã,10,1197,32974,116.5,"Trụ sở Đảng ủy, HĐND, UBND xã Cao Kỳ","Xã Tân Sơn, Xã Cao Kỳ, Xã Hòa Mục",105.903,22.0343
tỉnh Thái Nguyên,Tân Thành,xã,10,1191,30611,64.8,"Trụ sở Đảng ủy, HĐND, UBND xã Tân Thành","Xã Tân Hòa, Xã Tân Kim, Xã Tân Thành",106.006,21.5058
tỉnh Thái Nguyên,Thần Sa,xã,10,1165,601,146.08,"Trụ sở Đảng ủy, HĐND, UBND xã Thần Sa","Xã Thượng Nung, Xã Thần Xa",105.924,21.8287
tỉnh Thái Nguyên,Thành Công,xã,10,1186,28281,43.45,"Trụ sở Đảng ủy, HĐND, UBND xã Thành Công","Xã Vạn Phái, Xã Thành Công",105.787,21.3981
tỉnh Thái Nguyên,Thanh Mai,xã,10,1198,7406,111.08,"Trụ sở Đảng ủy, HĐND, UBND xã Thanh Mai","Xã Thanh Vận, Xã Mai Lạp, Xã Thanh Mai",105.759,22.0561
tỉnh Thái Nguyên,Thanh Thịnh,xã,10,1199,8802,112.31,"Trụ sở Đảng ủy, HĐND, UBND xã Nông Hạ","Xã Nông Hạ, Xã Thanh Thịnh",105.821,21.9635
tỉnh Thái Nguyên,Thượng Minh,xã,10,1105,1103,131.64,"Trụ sở Đảng ủy, HĐND, UBND xã Chu Hương","Xã Yến Dương, Xã Chu Hương, Xã Mỹ Phương",105.812,22.3536
tỉnh Thái Nguyên,Thượng Quan,xã,10,1276,3753,154.86,"Trụ sở Đảng ủy, HĐND, UBND xã Thượng Quan",Không sáp nhập,106.059,22.3779
tỉnh Thái Nguyên,Tích Lương,phường,10,1130,55278,23.56,"Trụ sở Đảng ủy, HĐND, UBND phường Tích Lương","Phường Trung Thành (thành phố Thái Nguyên), Phường Phú Xá, Phường Tân Thành, Phường Tân Lập, Phường Tích Lương, Phường Cam Giá",105.851,21.5432
tỉnh Thái Nguyên,Trại Cau,xã,10,1171,17327,82.85,"Trụ sở Đảng ủy, HĐND, UBND thị trấn Trại Cau","Thị trấn Trại Cau, Xã Hợp Tiến",106.011,21.5889
tỉnh Thái Nguyên,Trần Phú,xã,10,1206,7049,145.29,"Trụ sở Đảng ủy, HĐND, UBND xã Cư Lễ","Xã Văn Minh, Xã Cư Lễ, Xã Trần Phú",106.119,22.14
tỉnh Thái Nguyên,Tràng Xá,xã,10,1167,14609,119.18,"Trụ sở Đảng ủy, HĐND, UBND xã Tràng Xá","Xã Liên Minh, Xã Tràng Xá",106.063,21.6888
tỉnh Thái Nguyên,Trung Hội,xã,10,1149,13863,54.21,"Trụ sở Đảng ủy, HĐND, UBND xã Trung Hội","Xã Phú Tiến, Xã Bộc Nhiêu, Xã Trung Hội",105.634,21.8221
tỉnh Thái Nguyên,Trung Thành,phường,10,1187,37075,25.84,"Trụ sở Đảng ủy, HĐND, UBND phường Trung Thành","Phường Trung Thành (thành phố Phổ Yên), Phường Đông Cao, Phường Tân Phú, Phường Thuận Thành",105.881,21.3595
tỉnh Thái Nguyên,Văn Hán,xã,10,1155,19935,96.26,"Trụ sở Đảng ủy, HĐND, UBND xã Văn Hán","Xã Khe Mo, Xã Văn Hán",105.929,21.6645
tỉnh Thái Nguyên,Văn Lang,xã,10,1201,17949,54.06,"Trụ sở Đảng ủy, HĐND, UBND xã Văn Lang","Xã Kim Hỷ, Xã Lương Thượng, Xã Văn Lang",106.061,22.2586
tỉnh Thái Nguyên,Văn Lăng,xã,10,1154,9503,75.27,"Trụ sở Đảng ủy, HĐND, UBND xã Văn Lăng","Xã Hòa Bình, Xã Văn Lăng",105.829,21.7861
tỉnh Thái Nguyên,Vạn Phú,xã,10,1174,22062,51.2,"Trụ sở Đảng ủy, HĐND, UBND xã Vạn Phú","Xã Văn Yên, Xã Vạn Phú",105.637,21.5497
tỉnh Thái Nguyên,Vạn Xuân,phường,10,1184,6161,40.2,"Trụ sở Đảng ủy, HĐND, UBND phường Nam Tiến","Phường Nam Tiến, Phường Đồng Tiến, Phường Tân Hương, Phường Tiên Phong",105.897,21.4111
tỉnh Thái Nguyên,Vĩnh Thông,xã,10,1211,4631,129.55,"Trụ sở Đảng ủy, HĐND, UBND xã Vũ Muộn","Xã Sỹ Bình, Xã Vũ Muộn, Xã Cao Sơn",105.981,22.2099
tỉnh Thái Nguyên,Võ Nhai,xã,10,1163,17509,99.78,"Trụ sở Đảng ủy, HĐND, UBND huyện Võ Nhai hiện nay","Thị trấn Đình Cả, Xã Phú Thượng, Xã Lâu Thượng",106.112,21.758
tỉnh Thái Nguyên,Vô Tranh,xã,10,1153,38253,83.53,"Trụ sở Đảng ủy, HĐND, UBND xã Tức Tranh","Xã Tức Tranh, Xã Cổ Lũng, Xã Phú Đô, Xã Vô Tranh",105.772,21.7044
tỉnh Thái Nguyên,Xuân Dương,xã,10,1210,6621,206.7,"Trụ sở Đảng ủy, HĐND, UBND xã Xuân Dương","Xã Đổng Xá, Xã Liêm Thủy, Xã Xuân Dương",106.021,22.0097
tỉnh Thái Nguyên,Yên Bình,xã,10,1124,14813,119.22,"Trụ sở Đảng ủy, HĐND, UBND xã Yên Hân","Xã Yên Cư, Xã Bình Văn, Xã Yên Hân",105.936,21.9433
tỉnh Thái Nguyên,Yên Phong,xã,10,1122,7379,115.98,"Trụ sở Đảng ủy, HĐND, UBND xã Yên Phong","Xã Đại Sảo, Xã Yên Mỹ, Xã Yên Phong",105.63,22.0727
tỉnh Thái Nguyên,Yên Thịnh,xã,10,1121,5476,165.8,"Trụ sở Đảng ủy, HĐND, UBND xã Yên Thịnh","Xã Bản Thi, Xã Yên Thượng, Xã Yên Thịnh",105.502,22.2174
tỉnh Thái Nguyên,Yên Trạch,xã,10,1151,23543,112.68,"Trụ sở Đảng ủy, HĐND, UBND xã Yên Đổ","Xã Yên Ninh, Xã Yên Đổ, Xã Yên Trạch",105.719,21.8467
