tentinh,tenxa,loai,matinh,maxa,danso,dientich_km2,trungtam_hc,truoc_sapnhap,kinhdo,vido
tỉnh Tuyên Quang,An Tường,phường,8,2369,42952,53.44,đang cập nhật,"Phường Hưng Thành, Phường An Tường, Xã Lưỡng Vượng, Xã An Khang, Xã Hoàng Khai",105.22,21.7746
tỉnh Tuyên Quang,Bắc Mê,xã,8,2419,13043,154.3,đang cập nhật,"Thị trấn Yên Phú, Xã Yên Phong, Xã Lạc Nông",105.33,22.7505
tỉnh Tuyên Quang,Bắc Quang,xã,8,2433,33644,141.93,đang cập nhật,"Thị trấn Việt Quang, Xã Quang Minh, Xã Việt Vinh",104.845,22.4245
tỉnh Tuyên Quang,Bạch Đích,xã,8,2398,12747,95.17,đang cập nhật,"Xã Phú Lũng, Xã Na Khê, Xã Bạch Đích",105.03,23.1838
tỉnh Tuyên Quang,Bạch Ngọc,xã,8,2443,29021,72.2,đang cập nhật,"Xã Ngọc Minh, Xã Bạch Ngọc",105.081,22.5885
tỉnh Tuyên Quang,Bạch Xa,xã,8,2353,15309,127.41,đang cập nhật,"Xã Yên Thuận, Xã Minh Khương, Xã Bạch Xa",104.952,22.2667
tỉnh Tuyên Quang,Bản Máy,xã,8,2422,9792,76.17,đang cập nhật,"Xã Bản Phùng, Xã Chiến Phố, Xã Bản Máy",104.594,22.7983
tỉnh Tuyên Quang,Bằng Hành,xã,8,2436,1656,151.72,đang cập nhật,"Xã Kim Ngọc, Xã Vô Điếm, Xã Bằng Hành",104.955,22.4066
tỉnh Tuyên Quang,Bằng Lang,xã,8,2440,12167,115.66,đang cập nhật,"Xã Yên Hà, Xã Bằng Lang",104.614,22.3696
tỉnh Tuyên Quang,Bình An,xã,8,2341,59475,73.43,đang cập nhật,"Xã Thổ Bình, Xã Bình An",105.184,22.4068
tỉnh Tuyên Quang,Bình Ca,xã,8,2375,24339,69.48,đang cập nhật,"Xã Thượng Ấm, Xã Cấp Tiến, Xã Vĩnh Lợi",105.296,21.7274
tỉnh Tuyên Quang,Bình Thuận,phường,8,2370,47858,45.16,đang cập nhật,"Phường Đội Cấn, Xã Thái Long",105.232,21.7246
tỉnh Tuyên Quang,Bình Xa,xã,8,2356,17998,91.17,đang cập nhật,"Xã Minh Hương, Xã Bình Xa",105.114,22.1067
tỉnh Tuyên Quang,Cán Tỷ,xã,8,2403,9824,85.13,đang cập nhật,"Xã Bát Đại Sơn, Xã Cán Tỷ",105.012,23.1266
tỉnh Tuyên Quang,Cao Bồ,xã,8,2413,4211,111.18,đang cập nhật,Không sáp nhập,104.882,22.7574
tỉnh Tuyên Quang,Chiêm Hóa,xã,8,2340,đang cập nhật,111.265,đang cập nhật,"Thị trấn Vĩnh Lộc, Xã Xuân Quang, Xã Phúc Thịnh, Xã Ngọc Hội, Xã Trung Hòa",105.276,22.1621
tỉnh Tuyên Quang,Côn Lôn,xã,8,2336,5734,160.76,đang cập nhật,"Xã Sinh Long, Xã Côn Lôn",105.4,22.5583
tỉnh Tuyên Quang,Đồng Tâm,xã,8,2434,35573,248.8,đang cập nhật,"Xã Đồng Tiến, Xã Tân Phước, Xã Đồng Tâm",104.989,22.5008
tỉnh Tuyên Quang,Đông Thọ,xã,8,2376,18085,74.86,đang cập nhật,"Xã Đồng Quý, Xã Quyết Thắng, Xã Đông Thọ",105.286,21.6528
tỉnh Tuyên Quang,Đồng Văn,xã,8,2388,26015,122.49,đang cập nhật,"Thị trấn Đồng Văn, Xã Tả Lủng (huyện Đồng Văn), Xã Tả Phìn, Xã Thài Phìn Tủng, Xã Pải Lủng",105.347,23.2568
tỉnh Tuyên Quang,Đồng Yên,xã,8,2448,18326,79.36,đang cập nhật,"Xã Vĩnh Phúc, Xã Đồng Yên",104.786,22.225
tỉnh Tuyên Quang,Du Già,xã,8,2402,15829,126.94,đang cập nhật,"Xã Du Tiến, Xã Du Già",105.234,22.9154
tỉnh Tuyên Quang,Đường Hồng,xã,8,2445,11645,135.42,đang cập nhật,"Xã Đường Âm, Xã Phú Nam, Xã Đường Hồng",105.44,22.6431
tỉnh Tuyên Quang,Đường Thượng,xã,8,2401,14376,103.25,đang cập nhật,"Xã Lũng Hồ, Xã Đường Thượng",105.209,22.9901
tỉnh Tuyên Quang,Giáp Trung,xã,8,2418,622,73.21,đang cập nhật,Không sáp nhập,105.295,22.8059
tỉnh Tuyên Quang,Hà Giang 1,phường,8,2384,21652,82.69,đang cập nhật,"Phường Nguyễn Trãi, Xã Phương Thiện, Xã Phương Độ, Phường Quang Trung",104.935,22.8072
tỉnh Tuyên Quang,Hà Giang 2,phường,8,2383,331,60.62,đang cập nhật,"Phường Ngọc Hà, Phường Trần Phú, Phường Minh Khai, Phường Quang Trung, Xã Phong Quang",104.963,22.8605
tỉnh Tuyên Quang,Hàm Yên,xã,8,2352,29508,126.19,đang cập nhật,"Thị trấn Tân Yên, Xã Tân Thành (huyện Hàm Yên), Xã Bằng Cốc, Xã Nhân Mục",105.034,22.0481
tỉnh Tuyên Quang,Hồ Thầu,xã,8,2427,8709,136.83,đang cập nhật,"Xã Nậm Khòa, Xã Nam Sơn, Xã Hồ Thầu",104.659,22.6054
tỉnh Tuyên Quang,Hòa An,xã,8,2349,32937,61.62,đang cập nhật,"Xã Tân Thịnh, Xã Nhân Lý, Xã Hòa An",105.238,22.0906
tỉnh Tuyên Quang,Hoàng Su Phì,xã,8,2421,15645,86.65,đang cập nhật,"Thị trấn Vinh Quang, Xã Bản Luốc, Xã Ngàm Đăng Vài, Xã Tụ Nhân, Xã Đản Ván",104.686,22.7245
tỉnh Tuyên Quang,Hồng Sơn,xã,8,2378,29875,189.01,đang cập nhật,"Xã Chi Thiết, Xã Văn Phú, Xã Hồng Sơn",105.286,21.5933
tỉnh Tuyên Quang,Hồng Thái,xã,8,2338,25049,101.64,đang cập nhật,"Xã Đà Vị, Xã Sơn Phú, Xã Hồng Thái",105.503,22.417
tỉnh Tuyên Quang,Hùng An,xã,8,2437,17224,118.57,đang cập nhật,"Xã Việt Hồng, Xã Tiên Kiều, Xã Hùng An",104.823,22.3352
tỉnh Tuyên Quang,Hùng Đức,xã,8,2359,10368,63.63,đang cập nhật,Không sáp nhập,105.068,21.8984
tỉnh Tuyên Quang,Hùng Lợi,xã,8,2363,10882,168.93,đang cập nhật,"Xã Trung Minh, Xã Hùng Lợi",105.49,21.9247
tỉnh Tuyên Quang,Khâu Vai,xã,8,2395,22755,107.46,đang cập nhật,"Xã Cán Chu Phìn, Xã Lũng Pù, Xã Khâu Vai",105.481,23.1162
tỉnh Tuyên Quang,Khuôn Lùng,xã,8,2432,802,120.28,đang cập nhật,"Xã Nà Chì, Xã Khuôn Lùng",104.493,22.5228
tỉnh Tuyên Quang,Kiên Đài,xã,8,2347,9351,130.82,đang cập nhật,"Xã Phú Bình, Xã Kiên Đài",105.408,22.1216
tỉnh Tuyên Quang,Kiến Thiết,xã,8,2361,6783,109.48,đang cập nhật,Không sáp nhập,105.333,21.9778
tỉnh Tuyên Quang,Kim Bình,xã,8,2348,16873,92.09,đang cập nhật,"Xã Vinh Quang, Xã Bình Nhân, Xã Kim Bình",105.314,22.0783
tỉnh Tuyên Quang,Lâm Bình,xã,8,2334,12399,327.65,đang cập nhật,"Thị trấn Lăng Can, Xã Phúc Yên, Xã Xuân Lập",105.193,22.5503
tỉnh Tuyên Quang,Lao Chải,xã,8,2412,10135,157.99,đang cập nhật,"Xã Xín Chải, Xã Thanh Đức, Xã Lao Chải",104.79,22.8549
tỉnh Tuyên Quang,Liên Hiệp,xã,8,2447,10566,166.67,đang cập nhật,"Xã Hữu Sản, Xã Đức Xuân, Xã Liên Hiệp",105.04,22.3792
tỉnh Tuyên Quang,Linh Hồ,xã,8,2415,21725,181.44,đang cập nhật,"Xã Ngọc Linh, Xã Trung Thành, Xã Linh Hồ",105.096,22.6951
tỉnh Tuyên Quang,Lực Hành,xã,8,2360,11022,87.97,đang cập nhật,"Xã Quý Quân, Xã Chiêu Yên, Xã Lực Hành",105.199,22.0077
tỉnh Tuyên Quang,Lũng Cú,xã,8,2387,15115,95.2,đang cập nhật,"Xã Má Lé, Xã Lũng Táo, Xã Lũng Cú",105.302,23.3241
tỉnh Tuyên Quang,Lũng Phìn,xã,8,2390,16476,69.46,đang cập nhật,"Xã Sủng Trái, Xã Hố Quáng Phìn, Xã Lũng Phìn",105.262,23.1378
tỉnh Tuyên Quang,Lùng Tám,xã,8,2406,10971,124.14,đang cập nhật,"Xã Thái An, Xã Đông Hà, Xã Lùng Tám",105.077,23.0115
tỉnh Tuyên Quang,Mậu Duệ,xã,8,2399,19005,163.31,đang cập nhật,"Xã Ngam La, Xã Mậu Long, Xã Mậu Duệ",105.236,23.0564
tỉnh Tuyên Quang,Mèo Vạc,xã,8,2391,19675,92.21,đang cập nhật,"Thị trấn Mèo Vạc, Xã Tả Lủng (huyện Mèo Vạc), Xã Giàng Chu Phìn, Xã Pả Vi",105.41,23.1802
tỉnh Tuyên Quang,Minh Ngọc,xã,8,2420,7878,159.34,đang cập nhật,"Xã Minh Ngọc, Xã Thượng Tân, Xã Yên Định",105.218,22.7017
tỉnh Tuyên Quang,Minh Quang,xã,8,2342,20122,191.34,đang cập nhật,"Xã Phúc Sơn, Xã Hồng Quang, Xã Minh Quang",105.238,22.3105
tỉnh Tuyên Quang,Minh Sơn,xã,8,2417,29388,81.77,đang cập nhật,Không sáp nhập,105.204,22.8496
tỉnh Tuyên Quang,Minh Tân,xã,8,2408,7485,105.7,đang cập nhật,Không sáp nhập,104.919,22.9612
tỉnh Tuyên Quang,Minh Thanh,xã,8,2373,13453,78.57,đang cập nhật,"Xã Bình Yên, Xã Lương Thiện, Xã Minh Thanh",105.444,21.7343
tỉnh Tuyên Quang,Minh Xuân,phường,8,2331,72,34.9,đang cập nhật,"Phường Ỷ La, Phường Tân Hà, Phường Phan Thiết, Phường Minh Xuân, Phường Tân Quang, Xã Kim Phú",105.179,21.8095
tỉnh Tuyên Quang,Mỹ Lâm,phường,8,2368,31446,80.2,đang cập nhật,"Phường Mỹ Lâm, Xã Mỹ Bằng, Xã Kim Phú",105.115,21.7677
tỉnh Tuyên Quang,Nà Hang,xã,8,2333,17364,256.53,đang cập nhật,"Thị trấn Na Hang, Xã Năng Khả, Xã Thanh Tương",105.354,22.3334
tỉnh Tuyên Quang,Nấm Dẩn,xã,8,2450,11929,86.11,đang cập nhật,"Xã Chế Là, Xã Tả Nhìu, Xã Nấm Dẩn",104.509,22.6199
tỉnh Tuyên Quang,Nậm Dịch,xã,8,2426,854,97.78,đang cập nhật,"Xã Nậm Ty, Xã Tả Sử Choóng, Xã Nậm Dịch",104.751,22.641
tỉnh Tuyên Quang,Nghĩa Thuận,xã,8,2382,99,80.12,đang cập nhật,"Xã Thanh Vân, Xã Nghĩa Thuận",104.938,23.1222
tỉnh Tuyên Quang,Ngọc Đường,xã,8,2385,7858,98.07,đang cập nhật,"Xã Ngọc Đường, Xã Yên Định",105.094,22.8101
tỉnh Tuyên Quang,Ngọc Long,xã,8,2400,9989,84.26,đang cập nhật,Không sáp nhập,105.332,22.99
tỉnh Tuyên Quang,Nhữ Khê,xã,8,2371,21799,59.04,đang cập nhật,"Xã Nhữ Hán, Xã Đội Bình, Xã Nhữ Khê",105.177,21.7012
tỉnh Tuyên Quang,Niêm Sơn,xã,8,2396,12255,81.73,đang cập nhật,"Xã Niêm Tòng, Xã Niêm Sơn",105.431,23.0308
tỉnh Tuyên Quang,Nông Tiến,phường,8,2332,15393,26.99,đang cập nhật,"Phường Nông Tiến, Xã Tràng Đà, Xã Thái Bình",105.229,21.8384
tỉnh Tuyên Quang,Pà Vầy Sủ,xã,8,2449,15806,83.3,đang cập nhật,"Thị trấn Cốc Pài, Xã Nàn Ma, Xã Bản Ngò, Xã Pà Vầy Sủ",104.426,22.6704
tỉnh Tuyên Quang,Phố Bảng,xã,8,2454,15593,77.71,đang cập nhật,"Thị trấn Phố Bảng, Xã Phố Là, Xã Phố Cáo, Xã Lũng Thầu",105.174,23.2231
tỉnh Tuyên Quang,Phú Linh,xã,8,2386,1227,112.37,đang cập nhật,"Xã Kim Thạch, Xã Kim Linh, Xã Phú Linh",105.047,22.756
tỉnh Tuyên Quang,Phú Lương,xã,8,2380,43914,112.39,đang cập nhật,"Xã Đại Phú, Xã Tam Đa, Xã Phú Lương",105.393,21.5456
tỉnh Tuyên Quang,Phù Lưu,xã,8,2354,16154,120.45,đang cập nhật,"Xã Minh Dân, Xã Phù Lưu",105.032,22.1844
tỉnh Tuyên Quang,Pờ Ly Ngài,xã,8,2425,6239,49.34,đang cập nhật,"Xã Sán Sả Hồ, Xã Nàng Đôn, Xã Pờ Ly Ngài",104.62,22.7068
tỉnh Tuyên Quang,Quản Bạ,xã,8,2405,18436,102.87,đang cập nhật,"Thị trấn Tam Sơn, Xã Quyết Tiến, Xã Quản Bạ",104.979,23.0357
tỉnh Tuyên Quang,Quang Bình,xã,8,2452,10635,130.14,đang cập nhật,"Thị trấn Yên Bình, Xã Tân Nam",104.593,22.458
tỉnh Tuyên Quang,Quảng Nguyên,xã,8,2431,5949,99.48,đang cập nhật,Không sáp nhập,104.57,22.5802
tỉnh Tuyên Quang,Sà Phìn,xã,8,2389,16816,83.5,đang cập nhật,"Xã Sủng Là, Xã Sính Lủng, Xã Sảng Tủng, Xã Sà Phìn",105.245,23.225
tỉnh Tuyên Quang,Sơn Dương,xã,8,2372,41954,123.17,đang cập nhật,"Thị trấn Sơn Dương, Xã Hợp Thành, Xã Phúc Ứng, Xã Tú Thịnh",105.366,21.6824
tỉnh Tuyên Quang,Sơn Thủy,xã,8,2379,12658,95.77,đang cập nhật,"Xã Ninh Lai, Xã Thiện Kế, Xã Sơn Nam",105.488,21.5665
tỉnh Tuyên Quang,Sơn Vĩ,xã,8,2393,19975,110.62,đang cập nhật,"Xã Thượng Phùng, Xã Xín Cái, Xã Sơn Vĩ",105.479,23.214
tỉnh Tuyên Quang,Sủng Máng,xã,8,2392,12568,76.15,đang cập nhật,"Xã Lũng Chinh, Xã Sủng Trà, Xã Sủng Máng",105.328,23.1606
tỉnh Tuyên Quang,Tân An,xã,8,2346,41922,40.61,đang cập nhật,"Xã Hà Lang, Xã Tân An",105.152,22.2197
tỉnh Tuyên Quang,Tân Long,xã,8,2366,35492,102.12,đang cập nhật,"Xã Tân Tiến (huyện Yên Sơn), Xã Tân Long",105.266,21.8913
tỉnh Tuyên Quang,Tân Mỹ,xã,8,2344,24644,102.57,đang cập nhật,"Xã Hùng Mỹ, Xã Tân Mỹ",105.294,22.2396
tỉnh Tuyên Quang,Tân Quang,xã,8,2435,12425,174.14,đang cập nhật,"Xã Tân Thành (huyện Bắc Quang), Xã Tân Lập, Xã Tân Quang",104.85,22.5408
tỉnh Tuyên Quang,Tân Thanh,xã,8,2377,18116,114.5,đang cập nhật,"Xã Kháng Nhật, Xã Hợp Hòa, Xã Tân Thanh",105.41,21.6081
tỉnh Tuyên Quang,Tân Tiến,xã,8,2424,33994,207.2,đang cập nhật,"Xã Tân Tiến (huyện Hoàng Su Phì), Xã Bản Nhùng, Xã Túng Sán",104.762,22.7479
tỉnh Tuyên Quang,Tân Trào,xã,8,2374,14911,98.57,đang cập nhật,"Xã Kim Quan, Xã Trung Yên, Xã Tân Trào",105.458,21.8125
tỉnh Tuyên Quang,Tân Trịnh,xã,8,2439,1078,114.75,đang cập nhật,"Xã Tân Bắc, Xã Tân Trịnh",104.712,22.4212
tỉnh Tuyên Quang,Tát Ngà,xã,8,2394,7765,90.6,đang cập nhật,"Xã Nậm Ban, Xã Tát Ngà",105.384,23.09
tỉnh Tuyên Quang,Thái Bình,xã,8,2367,8346,305.25,đang cập nhật,"Xã Phú Thịnh, Xã Tiến Bộ, Xã Thái Bình",105.312,21.8014
tỉnh Tuyên Quang,Thái Hòa,xã,8,2358,23943,29,đang cập nhật,"Xã Đức Ninh, Xã Thái Hòa",105.119,21.9617
tỉnh Tuyên Quang,Thái Sơn,xã,8,2357,16385,93.54,đang cập nhật,"Xã Thành Long, Xã Thái Sơn",105.081,22.0209
tỉnh Tuyên Quang,Thắng Mố,xã,8,2453,đang cập nhật,67.68,đang cập nhật,"Xã Sủng Cháng, Xã Sủng Thài, Xã Thắng Mố",105.116,23.1948
tỉnh Tuyên Quang,Thàng Tín,xã,8,2423,7638,70.78,đang cập nhật,"Xã Pố Lồ, Xã Thèn Chu Phìn, Xã Thàng Tín",104.677,22.7985
tỉnh Tuyên Quang,Thanh Thủy,xã,8,2411,đang cập nhật,101.705,đang cập nhật,"Xã Phương Tiến, Xã Thanh Thủy",104.864,22.8672
tỉnh Tuyên Quang,Thông Nguyên,xã,8,2428,6255,108.7,đang cập nhật,"Xã Xuân Minh, Xã Thông Nguyên",104.748,22.5307
tỉnh Tuyên Quang,Thuận Hòa,xã,8,2409,29846,45.86,đang cập nhật,Không sáp nhập,105.005,22.9289
tỉnh Tuyên Quang,Thượng Lâm,xã,8,2339,9886,277.16,đang cập nhật,"Xã Khuôn Hà, Xã Thượng Lâm",105.31,22.5176
tỉnh Tuyên Quang,Thượng Nông,xã,8,2335,7204,79.83,đang cập nhật,"Xã Thượng Giáp, Xã Thượng Nông",105.493,22.5893
tỉnh Tuyên Quang,Thượng Sơn,xã,8,2414,6144,142.6,đang cập nhật,Không sáp nhập,104.835,22.6584
tỉnh Tuyên Quang,Tiên Nguyên,xã,8,2438,5027,90.13,đang cập nhật,Không sáp nhập,104.671,22.4944
tỉnh Tuyên Quang,Tiên Yên,xã,8,2442,14241,97.18,đang cập nhật,"Xã Vĩ Thượng, Xã Hương Sơn, Xã Tiên Yên",104.699,22.2874
tỉnh Tuyên Quang,Tri Phú,xã,8,2350,8686,170.26,đang cập nhật,"Xã Linh Phú, Xã Tri Phú",105.413,22.0252
tỉnh Tuyên Quang,Trung Hà,xã,8,2343,8303,103.18,đang cập nhật,Không sáp nhập,105.067,22.2854
tỉnh Tuyên Quang,Trung Sơn,xã,8,2364,3254,76.81,đang cập nhật,"Xã Đạo Viện, Xã Công Đa, Xã Trung Sơn",105.378,21.8641
tỉnh Tuyên Quang,Trung Thịnh,xã,8,2430,12277,72.11,đang cập nhật,"Xã Cốc Rế, Xã Thu Tà, Xã Trung Thịnh",104.555,22.6841
tỉnh Tuyên Quang,Trường Sinh,xã,8,2381,17615,53.36,đang cập nhật,"Xã Hào Phú, Xã Đông Lợi, Xã Trường Sinh",105.324,21.5624
tỉnh Tuyên Quang,Tùng Bá,xã,8,2410,8225,120.49,đang cập nhật,Không sáp nhập,105.099,22.8961
tỉnh Tuyên Quang,Tùng Vài,xã,8,2404,11221,149.98,đang cập nhật,"Xã Cao Mã Pờ, Xã Tả Ván, Xã Tùng Vài",104.869,23.0606
tỉnh Tuyên Quang,Vị Xuyên,xã,8,2407,23898,80.44,đang cập nhật,"Thị trấn Vị Xuyên, Thị trấn Nông trường Việt Lâm, Xã Đạo Đức, Xã Việt Lâm",104.971,22.6941
tỉnh Tuyên Quang,Việt Lâm,xã,8,2416,6419,92.66,đang cập nhật,"Xã Quảng Ngần, Xã Việt Lâm",104.907,22.6668
tỉnh Tuyên Quang,Vĩnh Tuy,xã,8,2446,36859,115.86,đang cập nhật,"Thị trấn Vĩnh Tuy, Xã Vĩnh Hảo, Xã Đông Thành",104.867,22.2474
tỉnh Tuyên Quang,Xín Mần,xã,8,2429,19596,125.24,đang cập nhật,"Xã Thèn Phàng, Xã Nàn Xỉn, Xã Bản Díu, Xã Chí Cà, Xã Xín Mần",104.512,22.7452
tỉnh Tuyên Quang,Xuân Giang,xã,8,2441,9234,86.06,đang cập nhật,"Xã Nà Khương, Xã Xuân Giang",104.632,22.313
tỉnh Tuyên Quang,Xuân Vân,xã,8,2362,1902,104.25,đang cập nhật,"Xã Trung Trực, Xã Phúc Ninh, Xã Xuân Vân",105.233,21.9467
tỉnh Tuyên Quang,Yên Cường,xã,8,2444,9741,116.9,đang cập nhật,"Xã Phiêng Luông, Xã Yên Cường",105.357,22.6782
tỉnh Tuyên Quang,Yên Hoa,xã,8,2337,7323,143.83,đang cập nhật,"Xã Khâu Tinh, Xã Yên Hoa",105.426,22.4474
tỉnh Tuyên Quang,Yên Lập,xã,8,2345,29678,69.05,đang cập nhật,"Xã Bình Phú, Xã Yên Lập",105.4,22.2146
tỉnh Tuyên Quang,Yên Minh,xã,8,2397,26556,154.7,đang cập nhật,"Thị trấn Yên Minh, Xã Lao Và Chải, Xã Hữu Vinh, Xã Đông Minh, Xã Vần Chải",105.139,23.0991
tỉnh Tuyên Quang,Yên Nguyên,xã,8,2351,16024,97.36,đang cập nhật,"Xã Hòa Phú, Xã Yên Nguyên",105.195,22.0914
tỉnh Tuyên Quang,Yên Phú,xã,8,2355,14964,42.61,đang cập nhật,"Xã Yên Lâm, Xã Yên Phú",104.934,22.1243
tỉnh Tuyên Quang,Yên Sơn,xã,8,2365,12614,116.62,đang cập nhật,"Thị trấn Yên Sơn, Xã Tứ Quận, Xã Lang Quán, Xã Chân Sơn",105.137,21.8622
tỉnh Tuyên Quang,Yên Thành,xã,8,2451,4778,38.13,đang cập nhật,"Xã Bản Rịa, Xã Yên Thành",104.514,22.4334
