place_id,name,address,lat,lng,matched_keyword
ChIJufxwYe9WRzERFSVRNx8kPPE,Karaoke Vang Vang,"33 Hoàng Diệu, Nam Lý",17.4676716,106.5977168,giải trí
ChIJJfqFJgBTRzERgTsTNhr7haw,KARAOKE Thảo Trâm,"31 Lê Duẩn, TT. Quán Hàu",17.4046408,106.6379482,giải trí
ChIJC4PFDwCXODER6X5LpeJu_5Y,Bida O Thú,"Q7QQ+G3R, QL12A, Cảnh Hoá",17.788859,106.28768,giải trí
ChIJ2_hJLQBRRzEROrxsM8zoUQM,RIO Billiards,"275 Quang Trung, Phú Hồng",17.4419263,106.6334081,giải trí
ChIJS7CaFsipODER1K7cypD3oQQ,Karaoke Anh & Em,"FGG6+HWQ, Đường Không Tên, TT. NT Việt Trung",17.4764612,106.5123718,giải trí
ChIJH_Klw5NXRzERQEYC1oG4a-Y,jobet store,"98 Lý Thái Tổ, Bắc Nghĩa",17.4428114,106.5957645,giải trí
ChIJcWGiFADrODERgSiW8kzuKV0,Quán BiDa Nghị Nguyễn,Cồn Cam,17.8186853,106.1261678,giải trí
ChIJKZdvbaJXRzERgkabbQwkTgU,jobet so,"126 Lý Thường Kiệt, Phường Hải Thành",17.480991,106.6173355,giải trí
ChIJBfWkno5ZRzERhEnZ6JAO7Ws,TM Billiards,"GHVG+5GX, Thôn 1",17.544089,106.5756189,giải trí
ChIJV27Vp0OpODERV7aBjSj_ho4,Hồ Câu Ông Thí,"Thôn, Quyết Thắng",17.4884391,106.526034,giải trí
ChIJw0kgtyuZODERBAVfZjt-SOE,Phong Thuận Billards club,Quảng Hải,17.7501156,106.3891915,giải trí
ChIJbayneti9ODERMC8cj_xxKjM,Nhà nghĩa bình,Thôn 1,17.6486742,106.2715023,giải trí
ChIJ-5xnfvZXRzERyQLdbiNGzi8,Karaoke Cây Dừa,"12 Phan Đăng Lưu, Đồng Sơn",17.4448401,106.5795427,giải trí
ChIJt_0TFi6ZODERweyXG2AutjE,Karaoke xuyên ngày đêm,TDP3- Quảng Phong,17.7555227,106.3996611,giải trí
ChIJofjrtSZXRzERoQv1ccm1nuY,Trung Tâm Giải Trí Karaoke 336,"336, Lý Thường Kiệt, TP Đồng Hới, Tỉnh Quảng Bình",17.482615,106.6117449,giải trí
ChIJD8xYj9JWRzERVmm-cG_bpP8,Công Viên Đồng Hải,"2 Quách Xuân Kỳ, Đồng Hải",17.4659535,106.6268278,Công viên
ChIJZ1YIAtZWRzERpbho2GUOUyc,Vườn Hoa Lê Quý Đôn,"35 Nguyễn Đức Cảnh, Đồng Hải",17.4772947,106.6228117,Công viên
ChIJaXY_79xWRzERCv9ZmnR4nOE,Công Viên Cá Heo TNN,"FJ95+GPW, Nam Sách",17.4688688,106.6093332,Công viên
ChIJJRU9v32nODERW-l-vp67Ttc,Công Viên Thị Trấn Hoàn Lão,"30 Quách Xuân Kỳ, TT. Hoàn Lão",17.5839555,106.5330827,Công viên
ChIJf78TL91XRzER5aRIeZcCI_8,Công Viên Thôn Đức Hoa,"CJQ5+JR7, Đức Phong",17.439033,106.6095539,Công viên
ChIJN_tpah1XRzER1lwdBDqbZmU,Công Viên Cầu Rào,"FJ85+H6H, Duy Tân, Phường Hải Thịnh",17.4664366,106.6081095,Công viên
ChIJ42n6YFRXRzERoJQePzHpduI,Công Viên Thôn Đức Thủy,"CJR7+8P7, Thôn Đức Thủy",17.4397782,106.614641,Công viên
ChIJAQAAJdRWRzERDeTzp6Mcfa0,Công viên TP.Đồng Hới,"FJFF+9GM, Đồng Hải",17.4734628,106.6237885,Công viên
ChIJcyFDRumZODERIOkSB02adPc,Công viên Bờ Kè Quảng Phong,"QC38+5CF, Ba Đồn",17.7529359,106.4160451,Công viên
ChIJmdVUHYlXRzERoFAxmCGvc3g,Công viên Bắc Trần Quang Khải,"FJH6+6MV, Trần Quang Khải, Phường Hải Thành",17.4784405,106.611415,Công viên
ChIJw_Hldm9VRzERPRni4FWHGCI,Nhà văn hoá thôn Vĩnh Tuy 1,"9JR9+9M8, Vĩnh Tuy",17.3909224,106.6192065,Công viên
ChIJ2_n8ad2xQDERZJ5xr5Dm5Po,Công viên Kiến Giang,"6QFV+VW7, TT. Kiến Giang",17.2246721,106.7948024,Công viên
ChIJL2ackDCZODERNbW2jZ9RPmE,Công viên Ba Đồn,"QC2C+W2H, Lê Quý Đôn, Ba Đồn",17.7523198,106.4201077,Công viên
ChIJ18MTDjixQDEROWHftmSd_lM,Công viên xã Mai Thủy,"5QRP+X5F, Chợ Động",17.1924394,106.7854172,Công viên
ChIJvaZe_0GxQDERmsOl1YHSm-A,AN LẠC VIÊN ĐẶNG VĂN TỘC,Văn Thủy,17.162339,106.807454,Công viên
ChIJZd-Q5-JXRzERWlU2uTdJC_k,Công viên Bắc Lê Lợi,"FJ69+5X6, Đồng Hải",17.4604154,106.6198935,Công viên
ChIJWUJtj7ygODERDfu4L8cC4to,Công Viên Lý Hòa,"JGRC+J6Q, Nội Hải",17.641597,106.5206111,Công viên
ChIJ950ZlkRXRzERyy9uwviyHCA,Công viên Cây Bồ Đề (Mini Park),"38 Ngô Quyền, Phường Hải Thịnh",17.4746615,106.6187233,Công viên
ChIJD72cOm5XRzEREDcwt46bFvA,Bãi tắm Tân Phú,"381 Trương Pháp, Quang Phú",17.5113865,106.614464,Công viên
ChIJlU71SvFXRzEROllBrt90vl4,Khu đô thị Tân Phú Quang Phú,"405 Trương Pháp, Quang Phú",17.509869,106.6123433,Công viên
ChIJd3E1cwBXRzERkcT8lOf5t8Q,Công viên,"FJM9+J55, trần quý kiên/38 Phùng Hưng, Phường Hải Thành",17.4817599,106.6170431,Công viên
ChIJnRk6qzBZRzERh2vb215Slz4,Công viên Cây Đa làng Lý Trạch,"GHQF+6M7 eco guava garden, Thôn 2",17.5376135,106.5745971,Công viên
ChIJUZiIzL6ZODERAN8iKyS3OhA,Nhà văn hóa Thôn tân hóa,"Thôn tân hóa, xã quảng tân, thị xã, Tân Tiến",17.7492662,106.3621164,Công viên
ChIJGVyUcc--ODERgNQwtaFLYM0,Bia Di tích sân bay dã chiến Khe Gát,"M659+QHM, Xuân Trạch",17.6594678,106.218927,Công viên
ChIJD-jaPXxXRzERXC0P9QWhPws,Trung tâm văn hoá thể thao Quang Phú,"GJ66+92M, Nguyễn Hữu Hào, Quang Phú",17.5109575,106.6100429,Công viên
ChIJLy3SpJGlODER1czqFnxDdrk,Mộng cảnh hills,"JC4P+C36, Unnamed Road",17.6060322,106.4351328,Công viên
ChIJBXx72NqlODER1UJ2lon2QZ0,Phong Nha riverside field town,"J9F2+8Q, Hưng Trạch",17.6232831,106.3519277,Công viên
ChIJnUq8ImGrQDERJxVrPaGupIM,Hồ Long Đại,"8JMC+5X8, Hiền Ninh",17.3329129,106.6224413,Công viên
ChIJR5aqV3BRRzERC8qKNYoXfLY,Angel Park,"FJ4W+F2R, Võ Nguyên Giáp, Bảo Ninh",17.4558839,106.6455323,Công viên
ChIJq2qEKwCZODER6HIPMBAiwlc,LAHA FARM VIETNAM.,"58 LAHA QUANG VAN, La Hà",17.7320852,106.4102603,Công viên
ChIJkULguAhRRzER4otfdECtGpY,Nón Lá Mẹ Suốt,"FJ4W+X8V, Võ Nguyên Giáp, Bảo Ninh",17.4580456,106.6444911,Công viên
ChIJHW1HfFWhODEROawRQ_KurNQ,Hệ sinh thái nước mặn,"PF73+CF2, Xuân Lộc",17.713503,106.4536431,Công viên
ChIJPRZVGABXRzERHEtbDG6fQFI,Công viên,"FJMC+J4Q, Bắc Lý",17.4840964,106.6203622,Công viên
ChIJ9UryegBRRzERH2nmUpxlxJY,Quảng trường biển Legend Sea Walk,"FJ5W+PRH, Bảo Xuân",17.4588507,106.6476851,Công viên
ChIJAbleE51ZRzERslAZyB9aSWQ,Nhân Trạch sand hills,"GHJR+QW8, Unnamed, Road",17.5319205,106.5923314,Công viên
ChIJ0aCtF--7ODERxHZQQvd7v5I,Suối Hà Lời,"H8X3+47, Sơn Trạch",17.5978165,106.3031658,Công viên
ChIJ6TubVv5TRzERna8HU4xT-_Q,Quảng trường huyện Quảng Ninh,"2 Nguyễn Trãi, TT. Quán Hàu",17.4043977,106.6418386,Công viên
ChIJ-Y52BgBRRzER1ECWF4WLo5Y,Sân cộng đồng Mỹ Cảnh,"FJGM+82Q, Mỹ Cảnh",17.475833,106.6325777,Công viên
ChIJBSMJb-2xQDERqH54zwuj9rY,Lòi Thần,"5PQW+VW, Phú Hòa Nam",17.1896377,106.7472651,Công viên
ChIJK6FfeeuZODERSiskHr23K_Y,Vườn hoa Hướng Dương,"Q9MX+PFF, Pháp Kệ",17.7843145,106.3986699,Công viên
ChIJr8BZGwCtQDER5tGc0ME6sW0,Cây duối cổ thụ,"8JCM+77, Xuân Dục",17.3206788,106.633168,Công viên
ChIJj66jHatXRzERSegf3HcVFJs,Công viên phường Đức Ninh Đông,"FJ59+4HM, Đức Ninh Đông",17.4578432,106.6189087,Công viên
ChIJ5W-1qwRXRzER-gX16U57TMU,Sân thể thao Đồng Choi,"CHQJ+QV6, Nguyễn Lương Bằng, Nghĩa Ninh",17.4394199,106.5821534,Công viên
ChIJJ1UD2-dWRzERJd4LHkeeHwI,Công Viên Thiếu Niên,"FJ93+6CC, Võ Thị Sáu, Nam Sách",17.4680592,106.6035299,Công viên
ChIJvaoWDABXRzERXzejkL4auMo,Công viên thôn Đức Sơn,Đức Ninh,17.4444379,106.6068146,Công viên
ChIJO_xhDxhXRzER0-EJzNVIGPY,Vườn Hoa Khe Chè,"GH65+J8W, Lý Trạch",17.5116215,106.5583243,Công viên
ChIJGQVOXSu7ODEReLh0HE9MsF4,Khu quy hoạch dân cư mới Cu Lac riverside,"J89M+CW, Sơn Trạch",17.6185998,106.3347968,Công viên
ChIJXdVd_ilXRzERZnapZHiiZrE,Công viên Nghĩa Trang Liệt Sỹ Đức Ninh,"CJR4+3PG, Đức Phong",17.4401861,106.6068182,Công viên
ChIJ3WR6oA1ZRzERmjDQBOeygF8,Vườn Hoa Phúc Lộc2,"GHRH+9PJ, Thôn 2",17.5409522,106.5792801,Công viên
ChIJJ1_zGPWlODERAsnQtiBtXJo,Greenfield Ecostay,Hưng Trạch,17.6220277,106.3528582,Công viên
ChIJqTaYs9uxQDERn8DiBAj9vKw,Trang trại Cuối Bình,"5RG6+CF, Mỹ Thuỷ",17.1760713,106.811213,Công viên
ChIJEy4E_JFRRzERjs8o9qQkxyw,Quảng trường nhạc nước Son Doong Mystery Light & Water Show,"FJ5V+8W8, Võ Nguyên Giáp, Bảo Ninh",17.4582965,106.6448315,Đài phun nước
ChIJFSZLG9izQDERgZAMvlsU80k,Đài tưởng niệm liệt sĩ,"6QP5+WGX, An Xá",17.2371146,106.7589731,Đài tưởng niệm
ChIJ46YqurWhODERMuh2ri4lFMo,Đài Tưởng Niệm,"JGRC+M26, Nội Hải",17.6419459,106.5202262,Đài tưởng niệm
ChIJM4uWK1qrQDERMrEluU2Kzhw,Đền Tưởng Niệm Liệt Sĩ Trường Sơn Bến Phà Long Đại,"8JGF+86V, Thôn Long Đại",17.3258649,106.6230426,Đài tưởng niệm
ChIJAbuqRzRXRzER9SU9OTMv8h0,Đài tưởng niệm Trương Pháp,"FJWG+C36, Đông Hải",17.4960499,106.6251394,Đài tưởng niệm
ChIJOfPuzoBTRzERD7dd9YWxr-4,Đài tưởng niệm Liệt Sỹ huyện Quảng Ninh,"CJ4P+4M6, Lê Duẩn, TT. Quán Hàu",17.4052849,106.6366485,Đài tưởng niệm
ChIJNfXLRKe-ODERoTDaw6hGmRQ,Đền thờ Liệt sĩ Khe Gát,"M64J+FMC, Hồ Chí Minh, Xuân Trạch",17.6561976,106.2316256,Đài tưởng niệm
ChIJIyCh752xQDERnYX8sGM9y3I,Đài tưởng niệm liệt sỹ,"6QM6+6H9, An Thuỷ",17.2329184,106.7613769,Đài tưởng niệm
ChIJ25vhNkGhODERFONPa6vKKG4,Khu tưởng niệm Thanh niên xung phong C283,"MFVP+54H Di tích lịch sử TNXP, C283 QL1A, Thanh Trạch",17.6930809,106.4854256,Đài tưởng niệm
ChIJ_b_rcrFXRzERRZirUh3ljL0,Bia tưởng niệm,"Công Viên Đồng Hải, 2 Quách Xuân Kỳ, Đồng Hải",17.4651621,106.6273195,Đài tưởng niệm
ChIJp0it6QekODER2PX0a0DVPRc,Tượng đài chiến thắng Cự Nẫm,"JCJH+2VX, ĐT2B, Cự Nẫm",17.6301013,106.4297238,Đài tưởng niệm
ChIJsx7n8dijODERr0Uq228WKnw,Đài Tưởng Niệm Liệt Sỹ,"PC5H+Q92, thôn 2",17.7094038,106.4283987,Đài tưởng niệm
ChIJkU0BvNqmODERuZqr-fZFwkI,Đài tưởng niệm Liệt sỹ xã Vạn Trạch,"JF7G+WVR, xóm Đông",17.6148684,106.4771382,Đài tưởng niệm
ChIJy0HrHNdXRzERflpcKs4vQMc,Tượng đài Bác Hồ với nhân dân Quảng Bình,"FJ9C+4JJ, Trần Phú, Đồng Hải",17.4678473,106.6215259,Đài tưởng niệm
ChIJoSxmwLygODERjdF4gFDRJ3k,Đài Tưởng Niệm,"Đài Tưởng Niệm, Ngoại Hòa, Hải Trạch, Bố Trạch, Quảng Bình, Việt Nam",17.6422123,106.5217209,Đài tưởng niệm
ChIJfdjHJRZLPzER-VWnmx4sJXk,"Đền tưởng niệm liệt sĩ Trường Sơn đường 20 Quyết Thắng, trọng điểm CÀ RÒONG - ATP","76Q4+P7, Thượng Trạch",17.2888568,106.2059165,Đài tưởng niệm
ChIJRep9RABXRzER-3oiYlUAyN8,Tượng đài liệt sỹ xã Nam Trạch,"GGHQ+XPP, Nam Trạch",17.5299054,106.5398674,Đài tưởng niệm
ChIJt1rzmpBXRzER0aaCltD2zFk,"Nghĩa trang liệt sĩ Đồng Hới, Quảng Bình","FJM9+VX9, Phan Huy Chú, Bắc Lý",17.4846726,106.6199749,Đài tưởng niệm
ChIJzfts9AutQDERpLpEgK5PKp0,Tượng Đài Anh Hùng Liệt Sỹ Xã Hoa Thủy,Hoa Thuỷ,17.2647402,106.705823,Đài tưởng niệm
ChIJX3sQSwBXRzERHLNR6yJToa8,Tâm Gém - Cơm Niêu Quảng Bình,"118 Hữu Nghị, Nam Lý",17.4730514,106.6036634,Lăng tẩm
ChIJfxbvjgZZRzERAmF7LSYmIs8,Cửa hàng Lăng mộ Tâm Phúc,"QL1A, Trung Trạch",17.5731449,106.5392519,Lăng tẩm
ChIJzw35q6lXRzERHyLnxC8Xjps,Di tích lô cốt Quang Phú,"GJ65+MXQ, Nguyễn Hữu Hào, Quang Phú",17.511703,106.6099817,Lô cốt
ChIJeT32Vc1XRzER3HtA7zKCFlo,Lô cốt Pháp xưa,"GJ94+JP6, Quang Phú",17.5190457,106.6067687,Lô cốt
ChIJJXnIMQBRRzERoIW6AC2P_Lg,Đoàn Nghệ Thuật Truyền Thống Quảng Trị,"FJ7Q+4VW, Hà Dương",17.4628639,106.6397054,Nhà hát
ChIJFeGn3QSlODERI3hcqGLOVeA,CM Studio - Nâng tầm giọng hát của bạn,"Thôn 1, Thanh Bình",17.6330926,106.3592217,Nhà hát
ChIJ2xtLMl9XRzERhyzJJBOOZ70,Nhớ Garden - restaurant,"Cầu Nhật Lệ 2/đường Điện Biên Phủ, Bảo Ninh",17.4491913,106.6409938,Nhà hát
ChIJUb_QJC9TRzER6PIGJFAmLKA,Nhà Văn Hóa Thôn Quảng Xá,"8MW9+3Q8, Tân Ninh",17.3451643,106.6694476,Nhà hát
ChIJc96zDfJXRzERpjqbaaeE3zE,Trung Tâm Văn Hóa Tỉnh Quảng Trị,"đường Tôn Thất Thuyết, Phường Hải Thịnh",17.4636296,106.6157478,Nhà hát
ChIJCbNTexCiODER2C6SkPXlJEQ,Đình làng Cao Lao Hạ,"PC5H+M6V, Hạ Trạch",17.7092583,106.4279543,Nhà hát
ChIJ__s_QIqxQDERw5z7E2Fyjic,DỊCH VỤ CHO THUÊ LOA HÁT KARAOKE TẠI NHÀ LỆ THUỶ-QUẢNG BÌNH -NHUẬN PHÁT,"20 Nguyễn Tất Thành, Đông thành",17.2312891,106.8005255,Nhà hát
ChIJMxqB8K2ZODEREuEYprQ9R3A,Sun Palace - Wedding & Event,"432 Quang Trung, thị xã",17.7574637,106.4174025,Nhà hát
ChIJ9SXDg-KhODERCAQvFvGBwNQ,Trung Tâm Xóm Hát,"JGQ2+95F, Ngã Ba Trung Tâm, 1, Đông Duyệt",17.6384364,106.5004101,Nhà hát
ChIJCTIoa7RRRzERYdVErArHRoc,Nhà vườn Thuyền Trưởng (The Captain's Garden House),"Điện Biên Phủ, Hà Thôn",17.4487464,106.64096,Nhà hát
ChIJP1w2bxGlODERo6AKWOZoIFc,Đồi Dẻ Eco,"JC73+942, Cự Nẫm",17.6107606,106.4052448,Nhà hát
ChIJ_5TkZ59TRzERy52uDWvRMDI,Nhà Hàng Karaoke Trầm Hương,"9MP2+XRC, Ngã ba Võ, Võ Ninh",17.3874281,106.6520011,Nhà hát
ChIJKcbvYwu8ODERv2_-BtPMYhQ,Nhà Thờ Giáo Xứ Đồng Troóc,"J7XF+VGH, Thôn Hai",17.6496843,106.2738664,Nhà hát
ChIJr11Jc7hXRzERblJ1KqrdM6I,BlueseaQB,"191 Trương Pháp, Bắc Lý",17.4953023,106.6255055,Nhà hát
ChIJnThxJiZXRzERbEj07BnYtfM,Netin Travel - Tour Du lịch Quảng Bình,"32 Phong Nha, Nam Lý",17.4723282,106.6021962,Nhà hát
ChIJs6ZVOp9XRzERwv3RwGk5mgs,The Ayatt Coffee,"Số 22, 36m Đường Phạm Văn Đồng, Nam Sách",17.4653403,106.6049007,Nhà hát
ChIJNcDl-06hODERQL0cXXOkZa0,LQ MEDIA,Thanh Vinh,17.693673,106.4860789,Nhà hát
ChIJeVKs_s5WRzERo9OI6Ar5FTI,Nhà hàng tiệc cưới Royal,"Đường Nguyễn Hữu Cảnh, Đồng Hải",17.465743,106.6187794,Nhà hát
ChIJE1QIJSC6ODERYZtg2Z8CdT0,Nhà Hàng Phương Nam II,"Hang Tối Chày Lập, Phúc Trạch",17.5779094,106.2542572,Nhà hát
ChIJ6wyZWgCXODERX2iX5qh6M0Q,Showroom audio Phan Hoà,"QL12A, Thôn 5",17.77325,106.3261315,Nhà hát
ChIJW47dhcOVODERccuD2pa9pTY,NHÀ VĂN HOÁ THÔN ĐÔNG HOÀ,"R67F+F2, Đông Hòa",17.8137687,106.2225218,Nhà văn hóa
ChIJVVJZgIVTRzERGlj8SZEIrnM,Nhà Văn Hoá Thôn Hoà Bình,Hỏa Lò,17.3418226,106.6633248,Nhà văn hóa
ChIJ_543IbinODERJyB4xM567TE,Nhà Văn Hóa Thôn Cà,"HF5X+8VF, Hoà Trạch",17.5583206,106.4996188,Nhà văn hóa
ChIJP9vqdwRXRzERTCQie4Y-QRg,Nhà văn hóa tiểu khu 8,"TK8 - Phường Bắc Lý, Đồng Phú",17.4859236,106.5899992,Nhà văn hóa
ChIJIVO-8D5XRzERvVWuS9-CDLY,Nhà văn hoá tổ dân phố Giao Tế,Đức Ninh,17.4451636,106.6140766,Nhà văn hóa
ChIJa1ABbVKwQDERl3RBL8MdveI,Nhà Văn Hóa Thôn Văn Xá,Văn Xá,17.1867782,106.759771,Nhà văn hóa
ChIJvWxOfrGnODER1QPUzzV-wbY,Nhà Văn Hóa Thôn Sỏi,xóm Sỏi,17.6093074,106.4765446,Nhà văn hóa
ChIJ09epDABRRzERv5jWNBZrCU0,Nhà văn hoá thôn Hà Thôn,"475 Nguyễn Thị Định, Bảo Ninh",17.4522014,106.6398907,Nhà văn hóa
ChIJWdYrdYJYRzERIrP8oJiCNZE,Nhà Văn Hóa Trung Tâm Huyện Bố Trạch,"HGMM+9J7, TT. Hoàn Lão",17.5833414,106.5337929,Nhà văn hóa
ChIJa6RetHFXRzERUymPhYRegtY,"Nhà văn hoá Tổ dân phố 6, phường Bắc Lý","Ngõ 337Phan Đình Phùng, Đồng Phú",17.4803082,106.5816046,Nhà văn hóa
ChIJLxWfLtuYODER-52O9Q8vNZ4,Nhà Văn Hóa Khu Phố 3,Ba Đồn,17.7583603,106.4252687,Nhà văn hóa
ChIJp1wxGTZXRzERyHi9tzIsyDU,Nhà Văn Hoá Đức Ninh,"CJV6+6Q3, Trấn Ninh, Đức Ninh",17.4429564,106.6118728,Nhà văn hóa
ChIJXepAQjm7ODERk3J1AauopX0,Nhà Văn Hóa Tổ Dân Phố Gia Tịnh,Gia Tĩnh,17.6232093,106.3325727,Nhà văn hóa
ChIJH5cxBSdXRzERboZGuoWDny0,Nhà văn hoá Tổ dân phố 3 Mỹ Cương,"FH4R+7MC, Nguyễn Kinh Chi, Đức Ninh",17.4559958,106.5917292,Nhà văn hóa
ChIJhXS7ieZXRzER6imKkoqP6Hk,Nhà văn hóa thôn Thuận Hóa,"CHQH+6CM, Vực Quành",17.4380982,106.5785556,Nhà văn hóa
ChIJ4SEWZABXRzER56NFocgaCu4,Nhà văn hóa tổ dân phố 1 đồng phú,"69 Phạm Hồng Thái, Phường Hải Thịnh",17.4667224,106.6181783,Nhà văn hóa
ChIJ3ReO3qKUODERQ_Cu4aNPW7U,Nhà văn hóa thôn Liên Hóa,"Liên Hóa,, Mai Hoá",17.8260766,106.178985,Nhà văn hóa
ChIJpcJDJu1XRzERwTKLKy23srY,Nhà văn hoá Thôn 7,"GH9G+4JG, Lý Trạch",17.5184829,106.5774478,Nhà văn hóa
ChIJ-dMqyLlXRzERdpcaKHuahRk,nhà văn hoá đồng hải,"FJ6C+XCH, 30 tháng 4, Đồng Hải",17.4624,106.6210951,Nhà văn hóa
ChIJl2lvdKulODERQHCdoZlTInw,Nhà văn hoá thôn Khương Hà 1,"J9FF+C82, Hưng Trạch",17.6235032,106.3732566,Nhà văn hóa
ChIJh-cOCvytQDER2TEUuaHXtvs,Nhà Văn Hóa Thôn Bắc,"8JPX+RVH, Cổ Hiền",17.3370591,106.6497433,Nhà văn hóa
ChIJG9UvSMlZRzERZIdD04E0kAc,Nhà văn hoá thôn 6 Lý Trạch,"GHPJ+5FH, Unnamed Road, Lý Trạch",17.535347,106.5812328,Nhà văn hóa
ChIJvbd5yz9XRzER85rjYuzILEI,Nhà văn hoá TDP4 - Phường Đồng Phú,"35 Lý Nam Đế, Phường Hải Thành",17.4765159,106.6158852,Nhà văn hóa
ChIJF3myBQBZRzER0Fu_fTSFAik,Nhà văn hoá thôn 4 lý trạch,"GHQC+9FG, Lý Trạch",17.5379782,106.5707212,Nhà văn hóa
ChIJKZNaFsenODERP4RW6YC3U0g,nhà văn hoá THÔN SEN,"HFXJ+8J, xóm Sen",17.5983125,106.4815625,Nhà văn hóa
ChIJHW_0BPtXRzERgkJdzBD8Epk,Nhà văn hoá thôn tân sơn,"36 Trần Nhật Duật, Đức Ninh",17.4512284,106.6050188,Nhà văn hóa
ChIJK1Mnu5hXRzERaFc_eRnvDAI,Nhà Văn Hóa Tổ Dân Phố 7 Phường Nam Lý,"23 Nguyễn Thiện Thuật, Nam Lý",17.4605603,106.5913249,Nhà văn hóa
ChIJeS-cHgCtQDEReexKEijzHS4,Nhà văn hoá thôn Xuân Sơn,"7M6R+432, Hoa Thuỷ",17.260399,106.6897516,Nhà văn hóa
ChIJG4vURCFZRzERUviWetRJe9Y,Nhà văn hoá thôn lý nhân,"Thôn lý nhân, Đại Trạch",17.5571648,106.555976,Nhà văn hóa
ChIJ39BpDbenODER4XjSwljYzDA,Nhà Văn Hóa Võ Thuận 1,"1, Võ Thuận",17.5778146,106.4902579,Nhà văn hóa
ChIJ-dptIZuzQDERcFre8WKYaHg,Nhà văn hóa Thôn 1 Thanh Tân,"7Q8P+4PV, Thanh Thuỷ",17.2653658,106.7868039,Nhà văn hóa
ChIJyxhkdbujODERb6EzLXgprDE,Nhà văn hoá thôn Mỹ Sơn,"JCW7+XF, Cự Nẫm",17.6475115,106.4138363,Nhà văn hóa
ChIJQzKQPaOVODERgQwVCDXvjek,Nhà văn hoá thôn Tây Trúc,"R65H+38W, xóm Trúc",17.8076096,106.2279297,Nhà văn hóa
ChIJ2fDSCMiZODERW9SHwAl78b4,Nhà văn hoá thôn Tiền Phong,"QCFC+8HV, Ba Đồn",17.7733545,106.421411,Nhà văn hóa
ChIJLTSVNHSlODERhFs3AaCxkQw,Nhà Văn hóa thôn Khương Hà 3,"J988+VWV, Hưng Trạch",17.6172341,106.3672917,Nhà văn hóa
ChIJMXvFRjFXRzERkO4sXz9T3NI,Nhà văn hoá thôn Đức Môn,"CJQ5+2V4, Unnamed, Road",17.4372101,106.6096584,Nhà văn hóa
ChIJRVioYXijODERDlldLgvcQKo,Nhà văn hoá thôn Bắc Sơn,"P9G3+8G3, Bắc Sơn, Quảng Sơn, TX, Ba Đồn",17.7256937,106.3538269,Nhà văn hóa
ChIJB9WBcfyhODERU-6GzWJMgVQ,Nhà Văn Hóa thôn 1,"MFW7+9CW, xóm 1",17.695995,106.4635817,Nhà văn hóa
ChIJo46QrZ2jODER70ryb_2uhSA,Nhà Văn Hoá Xóm 6,"P97J+63V, Quảng Minh",17.7129268,106.3794911,Nhà văn hóa
ChIJMYhqpgFTRzERnB1luo__-i8,Nhà văn hoá thôn Hiển Vinh,"Xóm 3, Hiển Vinh",17.3535846,106.6676099,Nhà văn hóa
ChIJrXKCRdZXRzERWqmck8oUpsI,Nhà văn hóa thôn Đức Phong,"CJV6+5H2, Đức Ninh",17.4428827,106.6113834,Nhà văn hóa
ChIJsVsSGx-nODERS_DAyTa0gj4,Nhà văn hóa thôn Rẫy,"JF2R+7JR, Vạn Trạch",17.6007381,106.4915192,Nhà văn hóa
ChIJVVVVBeWsQDEReKFXDpZ7PZo,Nhà Văn Hóa Thống Nhất,"8M38+286, An Ninh",17.3025468,106.6657575,Nhà văn hóa
ChIJe__v85xTRzERSX0jtWKOtYU,Nhà văn hóa Thôn Trúc Ly,"9JQV+696, Võ Duy Hàm, Võ Ninh",17.3880227,106.6433928,Nhà văn hóa
ChIJMcHxD4xTRzERYdh4QmmPCSA,"Nhà Văn Hóa Thôn Tân Định, xã Hải Ninh","ĐT564B, Hải Ninh",17.3742069,106.7214468,Nhà văn hóa
ChIJs_SwjiyfODERbPt-2lM3CsM,Nhà Văn hóa Thôn Thanh Bình,"Chòm 4 , Thanh Bình, Quảng Xuân",17.8047956,106.4424458,Nhà văn hóa
ChIJ_5fG-p6xQDERF7EAAOxOU4U,Nhà văn hoá thôn Phan Xá,"6Q7V+W23, Đường Lâm úy, Xuân Thuỷ",17.2148219,106.7926264,Nhà văn hóa
ChIJT_lMVI6nODEREBrh0hq45aQ,Nhà văn hóa Thôn Tây,"JF8G+H38, Unnamed Road, Vạn Trạch",17.616424,106.475211,Nhà văn hóa
ChIJh17TeNi9ODERom0WcVSlhdQ,Nhà văn hóa thôn Xuân Thủy,"P8HV+CGV, Thôn Xuân Thủy",17.728603,106.3438053,Nhà văn hóa
ChIJ_eqk69-nODERUu89F2ZUASI,Nhà văn hóa thôn Nam Định,"HCGW+W33, Unnamed Road, Phú Định",17.5772653,106.4451858,Nhà văn hóa
ChIJQUSOuq2pODERYFXb2KpZtRA,Nhà văn hóa thôn Đông Thành,"GG6C+J6, Đông Thành",17.5115987,106.5204965,Nhà văn hóa
ChIJMQDZaEqxQDERqXc0_R9VWi4,Nhà văn hóa thôn Tuy lộc,"6QM8+7HQ, Lộc Thuỷ",17.2332107,106.7664842,Nhà văn hóa
ChIJ04rRcwBXRzERTecoPO1nNBA,Nhà văn hoá tổ dân phố Diêm Trung,"FJ48+384, Đức Ninh Đông",17.4551482,106.6158386,Nhà văn hóa
ChIJg_oAR16bODER49FLPav9AuE,Nhà văn hóa thôn Hà Tiến,"RCM6+54R, Thôn Hà Tiến",17.8329851,106.410271,Nhà văn hóa
ChIJAQAQsXxTRzERHh_cVJhp2M0,Nhà văn hóa thôn Trường Niên,"9JFM+GJ3, Hàm Ninh",17.3737554,106.6340579,Nhà văn hóa
ChIJL0CmcEiXODERNy_eL4XVSzo,Nhà Văn Hóa thôn Xuân Sơn,"Q7GQ+JGV, Văn Hoá",17.7766079,106.2888001,Nhà văn hóa
ChIJUbP4TwCtQDERBq-DLog2TKY,Nhà Văn Hóa thôn Giữa,"7MJM+PC5, Unnamed, Road",17.2820199,106.6833469,Nhà văn hóa
ChIJV9GFx5hXRzERBBJs4j510u0,Nhà văn hoá Thôn 4 - Lộc Ninh,Lộc Ninh,17.4990991,106.5937786,Nhà văn hóa
ChIJS_4Pqf5XRzERMZ0Ze3k3zdk,Nhà Văn Hóa Thôn 11 - Hữu Cung,"GH6P+HGP, Lộc Ninh",17.5115322,106.5864172,Nhà văn hóa
ChIJgSpVlSlRRzERXLO08whSzd4,Nhà Hàng Quảng Trường,"FJFP+PJR, Đường Ven Biển, Bảo Xuân",17.4743278,106.6364647,Quảng trường
ChIJiaspkV6xQDERiRtDPDpUNd8,Quảng Trường,"Liên Thủy, Lệ Thủy",17.2286223,106.7982732,Quảng trường
ChIJe8jm0mRRRzERcFesL_hvpgI,Quảng trường biển Bảo Ninh,"Trần Hưng Đạo, Bảo Xuân",17.4747974,106.6361211,Quảng trường
ChIJD-YJjSlRRzERedsV-dQPi5I,Quảng trường biển Đồng Hới,"Quảng trường biển Đồng Hới, Bảo Ninh, Đồng Hới, Quảng Bình, Việt Nam",17.474439,106.6353934,Quảng trường
ChIJJalKU0mZODER2g1to6AChMM,Chợ Trường Quảng Hoà,"P9MH+5J6, Quảng Hoà, thị xã, Ba Đồn, Thanh Tân",17.7329011,106.379025,Quảng trường
ChIJLwBlDQZRRzERJVC1SfkNQOY,Quảng Trường biển Nhật Lệ,"Trần Hưng Đạo, Bảo Xuân",17.4748191,106.6361422,Quảng trường
ChIJVVmQEwBZRzERzZDaTM2ZSZU,Quảng trường biển Hoàn Lão,"HHM7+8CP, Trung Trạch",17.5833401,106.5635908,Quảng trường
ChIJvabRES6YODER9UKXV4E4SLw,Trường Tiểu học và Trung học cơ sở Quảng Trường,"Q994+GV4, Liên Trường",17.7687618,106.3572024,Quảng trường
ChIJ_____xOXODEROMU9DG42pNQ,Trường THCS Quảng Liên,"Q8W8+9Q8, Liên Trường",17.7959116,106.3169479,Quảng trường
ChIJ1fHKjNBXPzERwJalF29v5dA,Nhà Nghỉ Trường Thành,"6C9X+3VV, Long Sơn",17.2177248,106.4496935,Quảng trường
ChIJ7RghEgBXRzERIOt8u5UD9xM,Cát Quảng Bình - Quảng trường Hồ Chí Minh,"Dương Hùng Vương, Đồng Hải",17.4691137,106.6222065,Quảng trường
ChIJ06dvBCyYODERbXSEDGdLfYU,Trạm Y Tế Xã Quảng Trường,"Q9C3+44C, Liên Trường",17.770307,106.3527632,Quảng trường
ChIJNQMOVACxQDERAfaLFjBYkKQ,"Gara oto Quảng Trường Làm Lốp , Rửa Xe & Thay Dầu",Liên Thuỷ,17.228665,106.7983238,Quảng trường
ChIJVVVVFfGZODERWoG-6mRoJg0,Trường Tiểu Học Quảng Trường,"R977+C28, Chòm 5",17.81355,106.362568,Quảng trường
ChIJLU5cHABZRzERNipIZXWKrxk,Quảng trường biển mini,"HHP7+P6M, Trung Trạch",17.5868325,106.5630325,Quảng trường
ChIJEZg2HRGXODERE6GVwTZ_BYs,Liên Trường,"Liên Trường, Quảng Trạch, Quảng Bình, Việt Nam",17.7805679,106.308419,Quảng trường
ChIJRxSnL1dXRzERIPt-WfSVnts,LOTTE Cinema Đồng Hới - Vincom,"Vincom Plaza, Quách Xuân Kỳ, Đồng Hải",17.4653451,106.6265438,Rạp chiếu phim
ChIJywSlWYRXRzERlAxZOLT-fCE,Vincom Plaza Đồng Hới,"Quách Xuân Kỳ, P",17.4654359,106.6266764,Rạp chiếu phim
ChIJ0xNxZ8OYODERWJU7k4M3i9M,Siêu Thị Thái Hậu,"353 Quang Trung, Ba Đồn",17.756575,106.4223849,Rạp chiếu phim
ChIJszbe6M1WRzERoi_NYA-S5pE,Rạp 15/7,"1 Lê Trực, Đồng Hải",17.4644922,106.6241665,Rạp chiếu phim
ChIJM9FZZycLNTERmXJa8NuGpMk,Cafe Trung Nguyên Legend Quang Binh,"FJ4W+CPW, Võ Nguyên Giáp, Bảo Ninh",17.4561257,106.6468532,Rạp chiếu phim
ChIJETWxwc1WRzERDrF6IyHIB5g,Đồng Hới,"Đồng Hới, Quảng Bình, Việt Nam",17.4659391,106.5983958,Rạp chiếu phim
ChIJpaDbWtFWRzERLylgGdEihSE,Thư viện tỉnh Quảng Trị (trụ sở chính),"Nguyễn Văn Linh, Nam Lý",17.4738525,106.6073042,Thư viện
ChIJs349VLqxQDERWMdP3woYNZI,NPP Đông trùng hạ thảo Dr. Trung,Liên Thuỷ,17.2221818,106.7937137,Thư viện
ChIJ_fvEcJJTRzERB9h4qOKsq8s,Nhà Truyền Thống huyện Quảng Ninh,"CJ3R+8FH, Lê Duẩn, Tiểu khu 5",17.4033122,106.6412457,Thư viện
ChIJq8NzIQBZRzEReHQAma9x4jI,Thôn 4 Hoàn Lão( Trung Trach),"HHR3+V2C Mệ Trúc +7C, Trung Trạch",17.5921967,106.5525145,Thư viện
ChIJK5qg7nNXRzERufSTybsrTe4,Trung tâm học liệu - Đại học Quảng Bình,"FJJ4+JGF, Đồng Phú",17.4815691,106.606305,Thư viện
ChIJtw-esu5WRzERG8A2Y8SaK9c,Nhà hàng tiệc cưới Tân Trường Xanh,"57 Nguyễn Công Trứ, Nam Lý",17.4637726,106.5990043,Triển lãm
ChIJD-P8CwC7ODER8qsxd5NpCc0,Trung Tâm Tiệc Cưới- hội nghị - Nhà hàng CÔ CÚC,"TDP, Cù Lạc 1",17.6133466,106.3163518,Trung tâm hội nghị
ChIJzU6Qz6qjODERNDpfc4kV474,Trung Tâm Hội Nghị Tiệc Cưới Đội 3 Thôn Thọ Hạ,"P968+XRX, Thọ Hạ",17.7122992,106.3662879,Trung tâm hội nghị
ChIJMfdoRABXRzERIqeS81JZqog,Trung tâm tổ chức sự kiện Nhà hàng Nam Thảo,"27 Đ. Nguyen Gia Thieu, Bắc Nghĩa",17.4549643,106.5937326,Trung tâm hội nghị
