place_id,name,address,lat,lng,matched_keyword
ChIJlWsNmBdXRzERO7VqkAnKQLQ,Trung tâm Xét nghiệm Medic Quảng Bình,"15 Hữu Nghị, Đồng Phú",17.4836119,106.6041193,Trung tâm hội nghị
ChIJV1lkPuBWRzERjOODyUsojJo,Trung Tâm Huấn Luyện - Thể Thao Công An Tỉnh Quảng Bình,"95, Hữu Nghị, Thành Phố Đồng Hới, Tỉnh Quảng Bình, Đồng Phú",17.4780824,106.604923,Trung tâm hội nghị
ChIJXSGfzUJXRzERTn2YvLPd6Pw,Nhà Hàng Chang Chang Family,"Đường Phạm Văn Đồng/86 đường 36m, Đức Ninh Đông",17.4605176,106.611102,Trung tâm hội nghị
ChIJ58nZjO5WRzERjLiNirD1meQ,Trung Tâm Giới Thiệu Việc Làm Tỉnh Quảng Bình,"FH7W+HWV, Xuân Diệu, Nam Lý",17.4640044,106.5973007,Trung tâm hội nghị
ChIJQT37-9VXRzER3cetD454JzM,Nhà hàng Chạm - Đồng Hới,"126 Hữu Nghị, Nam Lý",17.4693921,106.6081895,Trung tâm hội nghị
ChIJQ2jLxuBWRzERw6xZr-ifESo,Đài Khí Tượng Thủy Văn Quảng Bình,"113 Hữu Nghị, Nam Lý",17.4743833,106.6040973,Tượng đài
ChIJrdQe7MGwODERO3-CLYGsaB0,Di tích lịch sử Đường 20 Quyết Thắng,"G736+HFJ, ĐT20, Tân Trạch",17.503962,106.261134,Tượng đài
ChIJ451r9H1ZRzERpDInqEUCCNE,"Vườn hoa hướng dương Thôn 4, Lý Trạch","GHQC+9FG, Lý Trạch",17.538427,106.5712113,Vườn hoa
ChIJfy6BKCtXRzERYfWnQmHhs68,Vườn hoa Nhật Nguyệt,"Tạ Quang Bửu, Nam Lý",17.4624386,106.5959587,Vườn hoa
ChIJ33FAYCZZRzERyETid8ddbto,VƯỜN HOA HẢI ĐĂNG,thôn 6,17.5304774,106.5843654,Vườn hoa
ChIJ7-O6VM1ZRzERWoHMrAtku3k,vườn hoa THIÊN ÂN,"JG8R+786, Đức Trung",17.6156734,106.5407666,Vườn hoa
ChIJF8lcxz6vQDERDMeExZp6toY,Vườn hoa Sơn Thiên,"Đội 1, Mỹ Đức, Sơn Thuỷ",17.2389487,106.6957769,Vườn hoa
ChIJlSZEvE27QDER-XkhTAPyUjU,Vườn Hoa Tuyết Trinh,Trường Thủy,17.1168783,106.8113223,Vườn hoa
ChIJ3ZBpFS-uQDERv7pyIae4H6o,Cây giống Hoa Cảnh Đức Hưng,Sơn Thuỷ,17.2351795,106.6969788,Vườn hoa
ChIJm4gCYQBXRzERIPbin5_KUWU,Vườn Hoa Tuấn Hồng,"GGHW+F53, Nhân Hồng",17.5286279,106.5454264,Vườn hoa
ChIJWULC0bizQDERoKzGtwjW4KM,Vườn Hoa Thanh Thuỷ Lệ Thuỷ,"7R22+PWC, QL1, Thanh Thuỷ",17.251816,106.802279,Vườn hoa
ChIJTQWWstujODERcxtrEYLyia0,Vườn hoa Hạnh Miền,"D4 Phú Hữu, Bô Trạch",17.6657017,106.3710465,Vườn hoa
ChIJ-XKd5U-nODERCU4_timZga4,Vườn hoa Vạn Trạch (chị Tiên),"JF88+C2C, Làng Dinh Lễ",17.616059,106.4650126,Vườn hoa
ChIJQc10XQ2ZODERPC7RkAjEMak,Vườn hoa Trần Thuý Dương,"PCM7+V5H, La Hà",17.734678,106.412969,Vườn hoa
ChIJXwG4CvefODER_beCBarV3Zg,Khương hoa giấy,"Tổ dân phố nhân thọ, phường",17.7668259,106.4520315,Vườn hoa
ChIJUw4vyG9XRzER8_zemH6Qyg4,Hoa Lan Phan Phan,"161 Phan Đình Phùng, Bắc Lý",17.4753018,106.5885034,Vườn hoa
ChIJBdZGTqqzQDERRYOutBgxMg0,Vườn Mai Huấn,"7Q5V+VGP, QL1A, Thanh Thuỷ",17.2597108,106.7938217,Vườn hoa
ChIJQcccdXCZODER-2gJodaYrR4,Vườn hoa Hưng Loan,"Chu Văn An, Quảng Hưng",17.8025844,106.4204892,Vườn hoa
ChIJr5hyUgBXRzER2be_HxXXrvk,Vườn hoa Thu Hà,"FH38+X37, Đồng Sơn",17.4549113,106.5651807,Vườn hoa
ChIJcYYomE9ZRzER5g5CnsCqKQM,Hai Vo Son Vườn Lan,"GGQV+VVH, Unnamed Road, Nam Trạch",17.5396827,106.5447213,Vườn hoa
ChIJ5_iiETesQDER6E2nk6TqDyc,Vườn cây sưa đỏ Hòa Quyết,"7M78+GH4, Đường (15 cũ), Vạn Ninh",17.2637798,106.6664647,Vườn hoa
ChIJueTm6tNXRzERCn0JvmRMfmw,Hoya Garden,"Nguyễn Văn Siêu, Bắc Nghĩa",17.4565678,106.591917,Vườn hoa
ChIJP3YlkYOwQDERBWqBscjVelg,Vườn Hoa,"Vườn Hoa, Trường Thủy, Lệ Thủy, Quảng Bình, Việt Nam",17.1485646,106.7787562,Vườn hoa
ChIJ69UK0KZZRzERIGPi4njEhK4,Lý Trạch eco guava garden,"GHQF+6M7, Thôn 2",17.5380487,106.574157,Vườn hoa
ChIJP3bOXQCXODERbMj3wil5tpg,Cây thị thôn Bàu Sỏi,Bàu Sỏi,17.7784446,106.2718446,Vườn hoa
ChIJpyXqkVGzQDERAr2DnXtIS2I,Vườn Rau Xanh Hồng Thủy,Hồng Thuỷ,17.2824142,106.7615512,Vườn hoa
ChIJ_xKbB-JXRzERaYkCskt3Vxk,Trang trại thắng mây,Thôn thuận hòa,17.4873658,106.5570909,Vườn hoa
ChIJXXvMrwK7ODER9LMyTnZaIo0,VƯỜN HOA PHONG NHA GARDEN,"J875+J5Q, Sơn Trạch",17.6140792,106.3079697,Vườn hoa
ChIJKXJ_rgmxQDERLHBWRtgVIbk,Khu lăng mộ Họ Nguyễn Văn,"Thôn, Vườn Hoa",17.1473993,106.7780281,Vườn hoa
ChIJeRgFWwCzQDERp0Jpd_b9iwY,Vườn hoa Thuận Yên,"8P8F+FW, Gia Ninh",17.316169,106.724867,Vườn hoa
ChIJt2hddEapODERB5lUKzu-fYU,Hoa Vàng Hill,Thôn Thuận Hoà,17.4701087,106.5324447,Vườn hoa
ChIJ1WjoptaVODERrN2hq_aNUyU,Vườn lan Phúc Lành,Thôn Tây Thủy,17.8084685,106.2398347,Vườn hoa
ChIJDbtYsSxXRzER8uIYoU4gaeQ,Nhà vườn Lộc Ninh,"Đường Nguyễn Hiến Lê, Thôn 10 Hữu Cung, Lộc Ninh",17.5045008,106.5923113,Vườn hoa
ChIJb0NUVPhXRzERQvnxFmYCrq0,Vườn svc Anh Hoàng,"Ngõ 22 Hoàng Quốc Việt, Đồng Sơn",17.4519087,106.5782922,Vườn hoa
ChIJLSzWOuSnODERMTZfaAVbmnQ,La La Farm,Thôn Hòa Đồng,17.5489476,106.5056124,Vườn hoa
ChIJrbyNdf6xQDERWjN9WWC8wJ4,Khu Lăng Mộ nhánh họ Lê Văn,"4QWH+87M, Thôn, Vườn Hoa",17.1458268,106.7781592,Vườn hoa
ChIJK5ys3GZTRzERPGriIZ_M_Nk,Cửa hàng tạp hoá cafe Sân vườn Trần Hoàng,"9J8P+3C5, Quyết Tiến",17.3651016,106.6361124,Vườn hoa
ChIJ3-b758tXRzERYoGnAOH_t7g,Nhà Vườn Ảnh Lý- Bán Sỉ lẻ Hoa cây cảnh,"681 Lý Thường Kiệt, Đồng Phú",17.4880806,106.6005672,Vườn hoa
ChIJNYA1bTuVODERjT0NkhO8vxo,Vườn xanh khangmyminh,Liên Sơn,17.8239444,106.1838484,Vườn hoa
ChIJ16i5AgCZODERy2spKojynMQ,Phước Hoa Flower (Hoa Tươi Quảng Bình),"150 Đ. Đào Duy Từ, Quảng Thuận",17.7497253,106.4290115,Vườn hoa
ChIJUYjHK11XRzER8BgXauf2fGw,Nhà Phúc Hiếu,TDP 7,17.6006116,106.5147797,Vườn hoa
ChIJZwDOwAJXRzERmbN8r5o_ppw,Nhà Văn Hoá Thôn Bắc Phú,"GJC4+99, Quang Phú",17.5209375,106.6059375,Vườn hoa
